[sudo] password for robert: 
smartctl 6.6 2016-05-31 r4324 [x86_64-linux-4.15.0-213-generic] (local build)
Copyright (C) 2002-16, Bruce Allen, Christian Franke, www.smartmontools.org

=== START OF INFORMATION SECTION ===
Model Family:     Seagate Barracuda Green (AF)
Device Model:     ST2000DL003-9VT166
Serial Number:    5YD5PQE7
LU WWN Device Id: 5 000c50 045a8b4bd
Firmware Version: CC3C
User Capacity:    2,000,398,934,016 bytes [2.00 TB]
Sector Sizes:     512 bytes logical, 4096 bytes physical
Rotation Rate:    5900 rpm
Device is:        In smartctl database [for details use: -P show]
ATA Version is:   ATA8-ACS T13/1699-D revision 4
SATA Version is:  SATA 3.0, 6.0 Gb/s (current: 6.0 Gb/s)
Local Time is:    Sun May 31 16:16:09 2026 NZST
SMART support is: Available - device has SMART capability.
SMART support is: Enabled
AAM level is:     254 (maximum performance), recommended: 254
APM feature is:   Unavailable
Rd look-ahead is: Enabled
Write cache is:   Enabled
ATA Security is:  Disabled, frozen [SEC2]
Wt Cache Reorder: Enabled

=== START OF READ SMART DATA SECTION ===
SMART overall-health self-assessment test result: PASSED
See vendor-specific Attribute list for marginal Attributes.

General SMART Values:
Offline data collection status:  (0x82)	Offline data collection activity
					was completed without error.
					Auto Offline Data Collection: Enabled.
Self-test execution status:      (   0)	The previous self-test routine completed
					without error or no self-test has ever 
					been run.
Total time to complete Offline 
data collection: 		(  602) seconds.
Offline data collection
capabilities: 			 (0x7b) SMART execute Offline immediate.
					Auto Offline data collection on/off support.
					Suspend Offline collection upon new
					command.
					Offline surface scan supported.
					Self-test supported.
					Conveyance Self-test supported.
					Selective Self-test supported.
SMART capabilities:            (0x0003)	Saves SMART data before entering
					power-saving mode.
					Supports SMART auto save timer.
Error logging capability:        (0x01)	Error logging supported.
					General Purpose Logging supported.
Short self-test routine 
recommended polling time: 	 (   1) minutes.
Extended self-test routine
recommended polling time: 	 ( 324) minutes.
Conveyance self-test routine
recommended polling time: 	 (   2) minutes.
SCT capabilities: 	       (0x30b7)	SCT Status supported.
					SCT Feature Control supported.
					SCT Data Table supported.

SMART Attributes Data Structure revision number: 10
Vendor Specific SMART Attributes with Thresholds:
ID# ATTRIBUTE_NAME          FLAGS    VALUE WORST THRESH FAIL RAW_VALUE
  1 Raw_Read_Error_Rate     POSR--   105   099   006    -    8452368
  3 Spin_Up_Time            PO----   092   092   000    -    0
  4 Start_Stop_Count        -O--CK   100   100   020    -    315
  5 Reallocated_Sector_Ct   PO--CK   100   100   036    -    0
  7 Seek_Error_Rate         POSR--   074   060   030    -    4322337232
  9 Power_On_Hours          -O--CK   093   093   000    -    6441
 10 Spin_Retry_Count        PO--C-   100   100   097    -    0
 12 Power_Cycle_Count       -O--CK   100   100   020    -    304
183 Runtime_Bad_Block       -O--CK   099   099   000    -    1
184 End-to-End_Error        -O--CK   100   100   099    -    0
187 Reported_Uncorrect      -O--CK   100   100   000    -    0
188 Command_Timeout         -O--CK   100   098   000    -    3
189 High_Fly_Writes         -O-RCK   100   100   000    -    0
190 Airflow_Temperature_Cel -O---K   070   044   045    Past 30 (0 2 38 30 0)
191 G-Sense_Error_Rate      -O--CK   100   100   000    -    0
192 Power-Off_Retract_Count -O--CK   100   100   000    -    276
193 Load_Cycle_Count        -O--CK   100   100   000    -    340
194 Temperature_Celsius     -O---K   030   056   000    -    30 (0 16 0 0 0)
195 Hardware_ECC_Recovered  -O-RC-   021   004   000    -    8452368
197 Current_Pending_Sector  -O--C-   100   100   000    -    0
198 Offline_Uncorrectable   ----C-   100   100   000    -    0
199 UDMA_CRC_Error_Count    -OSRCK   200   182   000    -    104030
240 Head_Flying_Hours       ------   100   253   000    -    5599 (2 78 0)
241 Total_LBAs_Written      ------   100   253   000    -    2931437449
242 Total_LBAs_Read         ------   100   253   000    -    826591112
                            ||||||_ K auto-keep
                            |||||__ C event count
                            ||||___ R error rate
                            |||____ S speed/performance
                            ||_____ O updated online
                            |______ P prefailure warning

General Purpose Log Directory Version 1
SMART           Log Directory Version 1 [multi-sector log support]
Address    Access  R/W   Size  Description
0x00       GPL,SL  R/O      1  Log Directory
0x01           SL  R/O      1  Summary SMART error log
0x02           SL  R/O      5  Comprehensive SMART error log
0x03       GPL     R/O      5  Ext. Comprehensive SMART error log
0x06           SL  R/O      1  SMART self-test log
0x07       GPL     R/O      1  Extended self-test log
0x09           SL  R/W      1  Selective self-test log
0x10       GPL     R/O      1  SATA NCQ Queued Error log
0x11       GPL     R/O      1  SATA Phy Event Counters log
0x21       GPL     R/O      1  Write stream error log
0x22       GPL     R/O      1  Read stream error log
0x80-0x9f  GPL,SL  R/W     16  Host vendor specific log
0xa1       GPL,SL  VS      20  Device vendor specific log
0xa2       GPL     VS    2248  Device vendor specific log
0xa8       GPL,SL  VS      20  Device vendor specific log
0xa9       GPL,SL  VS       1  Device vendor specific log
0xab       GPL     VS       1  Device vendor specific log
0xb0       GPL     VS    2819  Device vendor specific log
0xbd       GPL     VS     252  Device vendor specific log
0xbe-0xbf  GPL     VS   65535  Device vendor specific log
0xc0       GPL,SL  VS       1  Device vendor specific log
0xe0       GPL,SL  R/W      1  SCT Command/Status
0xe1       GPL,SL  R/W      1  SCT Data Transfer

SMART Extended Comprehensive Error Log Version: 1 (5 sectors)
No Errors Logged

SMART Extended Self-test Log Version: 1 (1 sectors)
Num  Test_Description    Status                  Remaining  LifeTime(hours)  LBA_of_first_error
# 1  Conveyance offline  Completed without error       00%      6441         -
# 2  Extended offline    Completed without error       00%      6398         -
# 3  Short offline       Completed without error       00%      6393         -

SMART Selective self-test log data structure revision number 1
 SPAN  MIN_LBA  MAX_LBA  CURRENT_TEST_STATUS
    1        0        0  Not_testing
    2        0        0  Not_testing
    3        0        0  Not_testing
    4        0        0  Not_testing
    5        0        0  Not_testing
Selective self-test flags (0x0):
  After scanning selected spans, do NOT read-scan remainder of disk.
If Selective self-test is pending on power-up, resume after 0 minute delay.

SCT Status Version:                  3
SCT Version (vendor specific):       522 (0x020a)
SCT Support Level:                   1
Device State:                        Active (0)
Current Temperature:                    30 Celsius
Power Cycle Min/Max Temperature:     30/38 Celsius
Lifetime    Min/Max Temperature:     16/55 Celsius
Under/Over Temperature Limit Count:   0/0

SCT Temperature History Version:     2
Temperature Sampling Period:         1 minute
Temperature Logging Interval:        59 minutes
Min/Max recommended Temperature:     14/55 Celsius
Min/Max Temperature Limit:           10/60 Celsius
Temperature History Size (Index):    128 (20)

Index    Estimated Time   Temperature Celsius
  21    2026-05-26 10:46    30  ***********
  22    2026-05-26 11:45    30  ***********
  23    2026-05-26 12:44    30  ***********
  24    2026-05-26 13:43    29  **********
  25    2026-05-26 14:42    29  **********
  26    2026-05-26 15:41    30  ***********
 ...    ..(  2 skipped).    ..  ***********
  29    2026-05-26 18:38    30  ***********
  30    2026-05-26 19:37    31  ************
  31    2026-05-26 20:36    31  ************
  32    2026-05-26 21:35    30  ***********
  33    2026-05-26 22:34    30  ***********
  34    2026-05-26 23:33    31  ************
 ...    ..(  4 skipped).    ..  ************
  39    2026-05-27 04:28    31  ************
  40    2026-05-27 05:27    30  ***********
  41    2026-05-27 06:26    30  ***********
  42    2026-05-27 07:25    30  ***********
  43    2026-05-27 08:24    31  ************
  44    2026-05-27 09:23    30  ***********
  45    2026-05-27 10:22    30  ***********
  46    2026-05-27 11:21    28  *********
  47    2026-05-27 12:20    28  *********
  48    2026-05-27 13:19    27  ********
  49    2026-05-27 14:18    28  *********
  50    2026-05-27 15:17    29  **********
  51    2026-05-27 16:16    30  ***********
  52    2026-05-27 17:15    29  **********
 ...    ..(  2 skipped).    ..  **********
  55    2026-05-27 20:12    29  **********
  56    2026-05-27 21:11    30  ***********
  57    2026-05-27 22:10    29  **********
  58    2026-05-27 23:09    30  ***********
  59    2026-05-28 00:08    30  ***********
  60    2026-05-28 01:07    30  ***********
  61    2026-05-28 02:06    29  **********
 ...    ..(  2 skipped).    ..  **********
  64    2026-05-28 05:03    29  **********
  65    2026-05-28 06:02    28  *********
  66    2026-05-28 07:01    26  *******
  67    2026-05-28 08:00    26  *******
  68    2026-05-28 08:59    28  *********
  69    2026-05-28 09:58    28  *********
  70    2026-05-28 10:57    29  **********
  71    2026-05-28 11:56    29  **********
  72    2026-05-28 12:55     ?  -
  73    2026-05-28 13:54    18  -
  74    2026-05-28 14:53     ?  -
  75    2026-05-28 15:52    20  *
  76    2026-05-28 16:51    34  ***************
  77    2026-05-28 17:50    36  *****************
  78    2026-05-28 18:49    37  ******************
  79    2026-05-28 19:48    36  *****************
  80    2026-05-28 20:47    36  *****************
  81    2026-05-28 21:46    38  *******************
 ...    ..(  3 skipped).    ..  *******************
  85    2026-05-29 01:42    38  *******************
  86    2026-05-29 02:41    37  ******************
  87    2026-05-29 03:40    39  ********************
  88    2026-05-29 04:39    38  *******************
 ...    ..(  2 skipped).    ..  *******************
  91    2026-05-29 07:36    38  *******************
  92    2026-05-29 08:35    36  *****************
  93    2026-05-29 09:34    36  *****************
  94    2026-05-29 10:33    37  ******************
  95    2026-05-29 11:32    38  *******************
  96    2026-05-29 12:31    38  *******************
  97    2026-05-29 13:30     ?  -
  98    2026-05-29 14:29    16  -
  99    2026-05-29 15:28    29  **********
 100    2026-05-29 16:27    31  ************
 101    2026-05-29 17:26    32  *************
 102    2026-05-29 18:25    32  *************
 103    2026-05-29 19:24    32  *************
 104    2026-05-29 20:23     ?  -
 105    2026-05-29 21:22    31  ************
 106    2026-05-29 22:21    34  ***************
 107    2026-05-29 23:20    33  **************
 108    2026-05-30 00:19    32  *************
 109    2026-05-30 01:18    32  *************
 110    2026-05-30 02:17    33  **************
 111    2026-05-30 03:16    33  **************
 112    2026-05-30 04:15    34  ***************
 ...    ..(  2 skipped).    ..  ***************
 115    2026-05-30 07:12    34  ***************
 116    2026-05-30 08:11    35  ****************
 117    2026-05-30 09:10    34  ***************
 ...    ..(  2 skipped).    ..  ***************
 120    2026-05-30 12:07    34  ***************
 121    2026-05-30 13:06    35  ****************
 ...    ..(  3 skipped).    ..  ****************
 125    2026-05-30 17:02    35  ****************
 126    2026-05-30 18:01    37  ******************
 ...    ..(  2 skipped).    ..  ******************
   1    2026-05-30 20:58    37  ******************
   2    2026-05-30 21:57    36  *****************
   3    2026-05-30 22:56    37  ******************
   4    2026-05-30 23:55    37  ******************
   5    2026-05-31 00:54    37  ******************
   6    2026-05-31 01:53    36  *****************
   7    2026-05-31 02:52    36  *****************
   8    2026-05-31 03:51    37  ******************
 ...    ..(  7 skipped).    ..  ******************
  16    2026-05-31 11:43    37  ******************
  17    2026-05-31 12:42    38  *******************
  18    2026-05-31 13:41    37  ******************
  19    2026-05-31 14:40    33  **************
  20    2026-05-31 15:39    30  ***********

SCT Error Recovery Control command not supported

Device Statistics (GP/SMART Log 0x04) not supported

SATA Phy Event Counters (GP Log 0x11)
ID      Size     Value  Description
0x000a  2            3  Device-to-host register FISes sent due to a COMRESET
0x0001  2            0  Command failed due to ICRC error
0x0003  2            0  R_ERR response for device-to-host data FIS
0x0004  2            0  R_ERR response for host-to-device data FIS
0x0006  2            0  R_ERR response for device-to-host non-data FIS
0x0007  2            0  R_ERR response for host-to-device non-data FIS

