[sudo] password for robert: 
smartctl 6.6 2016-05-31 r4324 [x86_64-linux-4.15.0-213-generic] (local build)
Copyright (C) 2002-16, Bruce Allen, Christian Franke, www.smartmontools.org

=== START OF INFORMATION SECTION ===
Model Family:     Seagate Barracuda Green (AF)
Device Model:     ST2000DL003-9VT166
Serial Number:    5YD5PQE7
LU WWN Device Id: 5 000c50 045a8b4bd
Firmware Version: CC3C
User Capacity:    2,000,398,934,016 bytes [2.00 TB]
Sector Sizes:     512 bytes logical, 4096 bytes physical
Rotation Rate:    5900 rpm
Device is:        In smartctl database [for details use: -P show]
ATA Version is:   ATA8-ACS T13/1699-D revision 4
SATA Version is:  SATA 3.0, 6.0 Gb/s (current: 6.0 Gb/s)
Local Time is:    Fri May 29 15:33:58 2026 NZST
SMART support is: Available - device has SMART capability.
SMART support is: Enabled
AAM level is:     254 (maximum performance), recommended: 254
APM feature is:   Unavailable
Rd look-ahead is: Enabled
Write cache is:   Enabled
ATA Security is:  Disabled, frozen [SEC2]
Wt Cache Reorder: Enabled

=== START OF READ SMART DATA SECTION ===
SMART overall-health self-assessment test result: PASSED
See vendor-specific Attribute list for marginal Attributes.

General SMART Values:
Offline data collection status:  (0x82)	Offline data collection activity
					was completed without error.
					Auto Offline Data Collection: Enabled.
Self-test execution status:      ( 249)	Self-test routine in progress...
					90% of test remaining.
Total time to complete Offline 
data collection: 		(  602) seconds.
Offline data collection
capabilities: 			 (0x7b) SMART execute Offline immediate.
					Auto Offline data collection on/off support.
					Suspend Offline collection upon new
					command.
					Offline surface scan supported.
					Self-test supported.
					Conveyance Self-test supported.
					Selective Self-test supported.
SMART capabilities:            (0x0003)	Saves SMART data before entering
					power-saving mode.
					Supports SMART auto save timer.
Error logging capability:        (0x01)	Error logging supported.
					General Purpose Logging supported.
Short self-test routine 
recommended polling time: 	 (   1) minutes.
Extended self-test routine
recommended polling time: 	 ( 324) minutes.
Conveyance self-test routine
recommended polling time: 	 (   2) minutes.
SCT capabilities: 	       (0x30b7)	SCT Status supported.
					SCT Feature Control supported.
					SCT Data Table supported.

SMART Attributes Data Structure revision number: 10
Vendor Specific SMART Attributes with Thresholds:
ID# ATTRIBUTE_NAME          FLAGS    VALUE WORST THRESH FAIL RAW_VALUE
  1 Raw_Read_Error_Rate     POSR--   108   099   006    -    15588384
  3 Spin_Up_Time            PO----   092   092   000    -    0
  4 Start_Stop_Count        -O--CK   100   100   020    -    314
  5 Reallocated_Sector_Ct   PO--CK   100   100   036    -    0
  7 Seek_Error_Rate         POSR--   074   060   030    -    4322273481
  9 Power_On_Hours          -O--CK   093   093   000    -    6393
 10 Spin_Retry_Count        PO--C-   100   100   097    -    0
 12 Power_Cycle_Count       -O--CK   100   100   020    -    303
183 Runtime_Bad_Block       -O--CK   099   099   000    -    1
184 End-to-End_Error        -O--CK   100   100   099    -    0
187 Reported_Uncorrect      -O--CK   100   100   000    -    0
188 Command_Timeout         -O--CK   100   098   000    -    3
189 High_Fly_Writes         -O-RCK   100   100   000    -    0
190 Airflow_Temperature_Cel -O---K   077   044   045    Past 23 (0 2 23 16 0)
191 G-Sense_Error_Rate      -O--CK   100   100   000    -    0
192 Power-Off_Retract_Count -O--CK   100   100   000    -    276
193 Load_Cycle_Count        -O--CK   100   100   000    -    339
194 Temperature_Celsius     -O---K   023   056   000    -    23 (0 16 0 0 0)
195 Hardware_ECC_Recovered  -O-RC-   015   004   000    -    15588384
197 Current_Pending_Sector  -O--C-   100   100   000    -    0
198 Offline_Uncorrectable   ----C-   100   100   000    -    0
199 UDMA_CRC_Error_Count    -OSRCK   200   182   000    -    104030
240 Head_Flying_Hours       ------   100   253   000    -    5551 (14 92 0)
241 Total_LBAs_Written      ------   100   253   000    -    239212458
242 Total_LBAs_Read         ------   100   253   000    -    2809520078
                            ||||||_ K auto-keep
                            |||||__ C event count
                            ||||___ R error rate
                            |||____ S speed/performance
                            ||_____ O updated online
                            |______ P prefailure warning

General Purpose Log Directory Version 1
SMART           Log Directory Version 1 [multi-sector log support]
Address    Access  R/W   Size  Description
0x00       GPL,SL  R/O      1  Log Directory
0x01           SL  R/O      1  Summary SMART error log
0x02           SL  R/O      5  Comprehensive SMART error log
0x03       GPL     R/O      5  Ext. Comprehensive SMART error log
0x06           SL  R/O      1  SMART self-test log
0x07       GPL     R/O      1  Extended self-test log
0x09           SL  R/W      1  Selective self-test log
0x10       GPL     R/O      1  SATA NCQ Queued Error log
0x11       GPL     R/O      1  SATA Phy Event Counters log
0x21       GPL     R/O      1  Write stream error log
0x22       GPL     R/O      1  Read stream error log
0x80-0x9f  GPL,SL  R/W     16  Host vendor specific log
0xa1       GPL,SL  VS      20  Device vendor specific log
0xa2       GPL     VS    2248  Device vendor specific log
0xa8       GPL,SL  VS      20  Device vendor specific log
0xa9       GPL,SL  VS       1  Device vendor specific log
0xab       GPL     VS       1  Device vendor specific log
0xb0       GPL     VS    2819  Device vendor specific log
0xbd       GPL     VS     252  Device vendor specific log
0xbe-0xbf  GPL     VS   65535  Device vendor specific log
0xc0       GPL,SL  VS       1  Device vendor specific log
0xe0       GPL,SL  R/W      1  SCT Command/Status
0xe1       GPL,SL  R/W      1  SCT Data Transfer

SMART Extended Comprehensive Error Log Version: 1 (5 sectors)
No Errors Logged

SMART Extended Self-test Log Version: 1 (1 sectors)
Num  Test_Description    Status                  Remaining  LifeTime(hours)  LBA_of_first_error
# 1  Extended offline    Self-test routine in progress 90%      6393         -
# 2  Short offline       Completed without error       00%      6393         -

SMART Selective self-test log data structure revision number 1
 SPAN  MIN_LBA  MAX_LBA  CURRENT_TEST_STATUS
    1        0        0  Not_testing
    2        0        0  Not_testing
    3        0        0  Not_testing
    4        0        0  Not_testing
    5        0        0  Not_testing
Selective self-test flags (0x0):
  After scanning selected spans, do NOT read-scan remainder of disk.
If Selective self-test is pending on power-up, resume after 0 minute delay.

SCT Status Version:                  3
SCT Version (vendor specific):       522 (0x020a)
SCT Support Level:                   1
Device State:                        Active (0)
Current Temperature:                    23 Celsius
Power Cycle Min/Max Temperature:     16/23 Celsius
Lifetime    Min/Max Temperature:     16/55 Celsius
Under/Over Temperature Limit Count:   0/0

SCT Temperature History Version:     2
Temperature Sampling Period:         1 minute
Temperature Logging Interval:        59 minutes
Min/Max recommended Temperature:     14/55 Celsius
Min/Max Temperature Limit:           10/60 Celsius
Temperature History Size (Index):    128 (98)

Index    Estimated Time   Temperature Celsius
  99    2026-05-24 10:35    28  *********
 100    2026-05-24 11:34    30  ***********
 101    2026-05-24 12:33    32  *************
 102    2026-05-24 13:32    32  *************
 103    2026-05-24 14:31    28  *********
 104    2026-05-24 15:30    29  **********
 105    2026-05-24 16:29    31  ************
 106    2026-05-24 17:28    30  ***********
 107    2026-05-24 18:27    29  **********
 ...    ..(  6 skipped).    ..  **********
 114    2026-05-25 01:20    29  **********
 115    2026-05-25 02:19    28  *********
 ...    ..(  2 skipped).    ..  *********
 118    2026-05-25 05:16    28  *********
 119    2026-05-25 06:15    27  ********
 120    2026-05-25 07:14    27  ********
 121    2026-05-25 08:13    26  *******
 122    2026-05-25 09:12    26  *******
 123    2026-05-25 10:11    27  ********
 124    2026-05-25 11:10    28  *********
 125    2026-05-25 12:09    29  **********
 126    2026-05-25 13:08    32  *************
 127    2026-05-25 14:07    31  ************
   0    2026-05-25 15:06    30  ***********
 ...    ..(  3 skipped).    ..  ***********
   4    2026-05-25 19:02    30  ***********
   5    2026-05-25 20:01    29  **********
 ...    ..(  3 skipped).    ..  **********
   9    2026-05-25 23:57    29  **********
  10    2026-05-26 00:56    30  ***********
 ...    ..(  5 skipped).    ..  ***********
  16    2026-05-26 06:50    30  ***********
  17    2026-05-26 07:49    28  *********
  18    2026-05-26 08:48    28  *********
  19    2026-05-26 09:47    26  *******
  20    2026-05-26 10:46    27  ********
  21    2026-05-26 11:45    30  ***********
  22    2026-05-26 12:44    30  ***********
  23    2026-05-26 13:43    30  ***********
  24    2026-05-26 14:42    29  **********
  25    2026-05-26 15:41    29  **********
  26    2026-05-26 16:40    30  ***********
 ...    ..(  2 skipped).    ..  ***********
  29    2026-05-26 19:37    30  ***********
  30    2026-05-26 20:36    31  ************
  31    2026-05-26 21:35    31  ************
  32    2026-05-26 22:34    30  ***********
  33    2026-05-26 23:33    30  ***********
  34    2026-05-27 00:32    31  ************
 ...    ..(  4 skipped).    ..  ************
  39    2026-05-27 05:27    31  ************
  40    2026-05-27 06:26    30  ***********
  41    2026-05-27 07:25    30  ***********
  42    2026-05-27 08:24    30  ***********
  43    2026-05-27 09:23    31  ************
  44    2026-05-27 10:22    30  ***********
  45    2026-05-27 11:21    30  ***********
  46    2026-05-27 12:20    28  *********
  47    2026-05-27 13:19    28  *********
  48    2026-05-27 14:18    27  ********
  49    2026-05-27 15:17    28  *********
  50    2026-05-27 16:16    29  **********
  51    2026-05-27 17:15    30  ***********
  52    2026-05-27 18:14    29  **********
 ...    ..(  2 skipped).    ..  **********
  55    2026-05-27 21:11    29  **********
  56    2026-05-27 22:10    30  ***********
  57    2026-05-27 23:09    29  **********
  58    2026-05-28 00:08    30  ***********
  59    2026-05-28 01:07    30  ***********
  60    2026-05-28 02:06    30  ***********
  61    2026-05-28 03:05    29  **********
 ...    ..(  2 skipped).    ..  **********
  64    2026-05-28 06:02    29  **********
  65    2026-05-28 07:01    28  *********
  66    2026-05-28 08:00    26  *******
  67    2026-05-28 08:59    26  *******
  68    2026-05-28 09:58    28  *********
  69    2026-05-28 10:57    28  *********
  70    2026-05-28 11:56    29  **********
  71    2026-05-28 12:55    29  **********
  72    2026-05-28 13:54     ?  -
  73    2026-05-28 14:53    18  -
  74    2026-05-28 15:52     ?  -
  75    2026-05-28 16:51    20  *
  76    2026-05-28 17:50    34  ***************
  77    2026-05-28 18:49    36  *****************
  78    2026-05-28 19:48    37  ******************
  79    2026-05-28 20:47    36  *****************
  80    2026-05-28 21:46    36  *****************
  81    2026-05-28 22:45    38  *******************
 ...    ..(  3 skipped).    ..  *******************
  85    2026-05-29 02:41    38  *******************
  86    2026-05-29 03:40    37  ******************
  87    2026-05-29 04:39    39  ********************
  88    2026-05-29 05:38    38  *******************
 ...    ..(  2 skipped).    ..  *******************
  91    2026-05-29 08:35    38  *******************
  92    2026-05-29 09:34    36  *****************
  93    2026-05-29 10:33    36  *****************
  94    2026-05-29 11:32    37  ******************
  95    2026-05-29 12:31    38  *******************
  96    2026-05-29 13:30    38  *******************
  97    2026-05-29 14:29     ?  -
  98    2026-05-29 15:28    16  -

SCT Error Recovery Control command not supported

Device Statistics (GP/SMART Log 0x04) not supported

SATA Phy Event Counters (GP Log 0x11)
ID      Size     Value  Description
0x000a  2            3  Device-to-host register FISes sent due to a COMRESET
0x0001  2            0  Command failed due to ICRC error
0x0003  2            0  R_ERR response for device-to-host data FIS
0x0004  2            0  R_ERR response for host-to-device data FIS
0x0006  2            0  R_ERR response for device-to-host non-data FIS
0x0007  2            0  R_ERR response for host-to-device non-data FIS

