[sudo] password for robert: 
smartctl 6.6 2016-05-31 r4324 [x86_64-linux-4.15.0-213-generic] (local build)
Copyright (C) 2002-16, Bruce Allen, Christian Franke, www.smartmontools.org

=== START OF INFORMATION SECTION ===
Model Family:     Seagate NAS HDD
Device Model:     ST2000VN000-1HJ164
Serial Number:    W520VJFQ
LU WWN Device Id: 5 000c50 08295dc9d
Firmware Version: SC60
User Capacity:    2,000,398,934,016 bytes [2.00 TB]
Sector Sizes:     512 bytes logical, 4096 bytes physical
Rotation Rate:    5900 rpm
Form Factor:      3.5 inches
Device is:        In smartctl database [for details use: -P show]
ATA Version is:   ACS-2, ACS-3 T13/2161-D revision 3b
SATA Version is:  SATA 3.1, 6.0 Gb/s (current: 6.0 Gb/s)
Local Time is:    Sun May 24 22:52:17 2026 NZST
SMART support is: Available - device has SMART capability.
SMART support is: Enabled
AAM feature is:   Unavailable
APM level is:     254 (maximum performance)
Rd look-ahead is: Enabled
Write cache is:   Enabled
ATA Security is:  Disabled, frozen [SEC2]
Wt Cache Reorder: Enabled

=== START OF READ SMART DATA SECTION ===
SMART overall-health self-assessment test result: PASSED

General SMART Values:
Offline data collection status:  (0x82)	Offline data collection activity
					was completed without error.
					Auto Offline Data Collection: Enabled.
Self-test execution status:      (   0)	The previous self-test routine completed
					without error or no self-test has ever 
					been run.
Total time to complete Offline 
data collection: 		(  107) seconds.
Offline data collection
capabilities: 			 (0x7b) SMART execute Offline immediate.
					Auto Offline data collection on/off support.
					Suspend Offline collection upon new
					command.
					Offline surface scan supported.
					Self-test supported.
					Conveyance Self-test supported.
					Selective Self-test supported.
SMART capabilities:            (0x0003)	Saves SMART data before entering
					power-saving mode.
					Supports SMART auto save timer.
Error logging capability:        (0x01)	Error logging supported.
					General Purpose Logging supported.
Short self-test routine 
recommended polling time: 	 (   1) minutes.
Extended self-test routine
recommended polling time: 	 ( 265) minutes.
Conveyance self-test routine
recommended polling time: 	 (   2) minutes.
SCT capabilities: 	       (0x10bd)	SCT Status supported.
					SCT Error Recovery Control supported.
					SCT Feature Control supported.
					SCT Data Table supported.

SMART Attributes Data Structure revision number: 10
Vendor Specific SMART Attributes with Thresholds:
ID# ATTRIBUTE_NAME          FLAGS    VALUE WORST THRESH FAIL RAW_VALUE
  1 Raw_Read_Error_Rate     POSR--   112   099   006    -    49389592
  3 Spin_Up_Time            PO----   095   095   000    -    0
  4 Start_Stop_Count        -O--CK   100   100   020    -    87
  5 Reallocated_Sector_Ct   PO--CK   100   100   010    -    0
  7 Seek_Error_Rate         POSR--   089   060   030    -    897741349
  9 Power_On_Hours          -O--CK   036   036   000    -    56368
 10 Spin_Retry_Count        PO--C-   100   100   097    -    0
 12 Power_Cycle_Count       -O--CK   100   100   020    -    87
184 End-to-End_Error        -O--CK   100   100   099    -    0
187 Reported_Uncorrect      -O--CK   100   100   000    -    0
188 Command_Timeout         -O--CK   100   100   000    -    0
189 High_Fly_Writes         -O-RCK   063   063   000    -    37
190 Airflow_Temperature_Cel -O---K   072   056   045    -    28 (Min/Max 15/35)
191 G-Sense_Error_Rate      -O--CK   100   100   000    -    0
192 Power-Off_Retract_Count -O--CK   100   100   000    -    8
193 Load_Cycle_Count        -O--CK   099   099   000    -    2393
194 Temperature_Celsius     -O---K   028   044   000    -    28 (0 15 0 0 0)
197 Current_Pending_Sector  -O--C-   100   100   000    -    0
198 Offline_Uncorrectable   ----C-   100   100   000    -    0
199 UDMA_CRC_Error_Count    -OSRCK   200   200   000    -    0
                            ||||||_ K auto-keep
                            |||||__ C event count
                            ||||___ R error rate
                            |||____ S speed/performance
                            ||_____ O updated online
                            |______ P prefailure warning

General Purpose Log Directory Version 1
SMART           Log Directory Version 1 [multi-sector log support]
Address    Access  R/W   Size  Description
0x00       GPL,SL  R/O      1  Log Directory
0x01           SL  R/O      1  Summary SMART error log
0x02           SL  R/O      5  Comprehensive SMART error log
0x03       GPL     R/O      5  Ext. Comprehensive SMART error log
0x06           SL  R/O      1  SMART self-test log
0x07       GPL     R/O      1  Extended self-test log
0x09           SL  R/W      1  Selective self-test log
0x10       GPL     R/O      1  SATA NCQ Queued Error log
0x11       GPL     R/O      1  SATA Phy Event Counters log
0x15       GPL     R/W      1  SATA Rebuild Assist log
0x21       GPL     R/O      1  Write stream error log
0x22       GPL     R/O      1  Read stream error log
0x80-0x9f  GPL,SL  R/W     16  Host vendor specific log
0xa1       GPL,SL  VS      20  Device vendor specific log
0xa2       GPL     VS    4496  Device vendor specific log
0xa8       GPL,SL  VS     129  Device vendor specific log
0xa9       GPL,SL  VS       1  Device vendor specific log
0xab       GPL     VS       1  Device vendor specific log
0xb0       GPL     VS    5176  Device vendor specific log
0xbe-0xbf  GPL     VS   65535  Device vendor specific log
0xc0       GPL,SL  VS       1  Device vendor specific log
0xc1       GPL,SL  VS      10  Device vendor specific log
0xc3       GPL,SL  VS       8  Device vendor specific log
0xc4       GPL,SL  VS       5  Device vendor specific log
0xd1       GPL,SL  VS       8  Device vendor specific log
0xe0       GPL,SL  R/W      1  SCT Command/Status
0xe1       GPL,SL  R/W      1  SCT Data Transfer

SMART Extended Comprehensive Error Log Version: 1 (5 sectors)
No Errors Logged

SMART Extended Self-test Log Version: 1 (1 sectors)
Num  Test_Description    Status                  Remaining  LifeTime(hours)  LBA_of_first_error
# 1  Extended offline    Completed without error       00%     56279         -
# 2  Short offline       Completed without error       00%     55096         -
# 3  Short offline       Completed without error       00%     54352         -
# 4  Short offline       Completed without error       00%     53608         -
# 5  Short offline       Completed without error       00%     52888         -
# 6  Short offline       Completed without error       00%     52144         -
# 7  Short offline       Completed without error       00%     51424         -
# 8  Short offline       Completed without error       00%     50679         -
# 9  Short offline       Completed without error       00%     50007         -
#10  Short offline       Completed without error       00%     49263         -
#11  Short offline       Completed without error       00%     48520         -
#12  Short offline       Completed without error       00%     47800         -
#13  Short offline       Completed without error       00%     47056         -
#14  Short offline       Completed without error       00%     46337         -
#15  Short offline       Completed without error       00%     45593         -
#16  Short offline       Completed without error       00%     44849         -
#17  Short offline       Completed without error       00%     44129         -
#18  Short offline       Completed without error       00%     43385         -
#19  Short offline       Completed without error       00%     42665         -

SMART Selective self-test log data structure revision number 1
 SPAN  MIN_LBA  MAX_LBA  CURRENT_TEST_STATUS
    1        0        0  Not_testing
    2        0        0  Not_testing
    3        0        0  Not_testing
    4        0        0  Not_testing
    5        0        0  Not_testing
Selective self-test flags (0x0):
  After scanning selected spans, do NOT read-scan remainder of disk.
If Selective self-test is pending on power-up, resume after 0 minute delay.

SCT Status Version:                  3
SCT Version (vendor specific):       522 (0x020a)
SCT Support Level:                   1
Device State:                        Active (0)
Current Temperature:                    27 Celsius
Power Cycle Min/Max Temperature:     15/35 Celsius
Lifetime    Min/Max Temperature:     15/43 Celsius
Under/Over Temperature Limit Count:   0/0

SCT Temperature History Version:     2
Temperature Sampling Period:         1 minute
Temperature Logging Interval:        94 minutes
Min/Max recommended Temperature:      1/61 Celsius
Min/Max Temperature Limit:            2/60 Celsius
Temperature History Size (Index):    128 (70)

Index    Estimated Time   Temperature Celsius
  71    2026-05-16 15:12    37  ******************
  72    2026-05-16 16:46    35  ****************
  73    2026-05-16 18:20    34  ***************
  74    2026-05-16 19:54    34  ***************
  75    2026-05-16 21:28    33  **************
  76    2026-05-16 23:02    33  **************
  77    2026-05-17 00:36    32  *************
  78    2026-05-17 02:10    32  *************
  79    2026-05-17 03:44    34  ***************
  80    2026-05-17 05:18    37  ******************
  81    2026-05-17 06:52    37  ******************
  82    2026-05-17 08:26    38  *******************
  83    2026-05-17 10:00    38  *******************
  84    2026-05-17 11:34    39  ********************
  85    2026-05-17 13:08    40  *********************
  86    2026-05-17 14:42    39  ********************
  87    2026-05-17 16:16    36  *****************
  88    2026-05-17 17:50    35  ****************
  89    2026-05-17 19:24    34  ***************
  90    2026-05-17 20:58    34  ***************
  91    2026-05-17 22:32    33  **************
 ...    ..(  2 skipped).    ..  **************
  94    2026-05-18 03:14    33  **************
  95    2026-05-18 04:48    36  *****************
  96    2026-05-18 06:22    37  ******************
  97    2026-05-18 07:56    38  *******************
  98    2026-05-18 09:30    39  ********************
  99    2026-05-18 11:04    40  *********************
 100    2026-05-18 12:38    39  ********************
 101    2026-05-18 14:12    37  ******************
 102    2026-05-18 15:46    36  *****************
 103    2026-05-18 17:20    35  ****************
 104    2026-05-18 18:54    35  ****************
 105    2026-05-18 20:28    34  ***************
 106    2026-05-18 22:02    34  ***************
 107    2026-05-18 23:36    34  ***************
 108    2026-05-19 01:10    33  **************
 109    2026-05-19 02:44    33  **************
 110    2026-05-19 04:18    36  *****************
 111    2026-05-19 05:52    37  ******************
 112    2026-05-19 07:26    38  *******************
 113    2026-05-19 09:00    38  *******************
 114    2026-05-19 10:34    38  *******************
 115    2026-05-19 12:08    39  ********************
 116    2026-05-19 13:42    38  *******************
 117    2026-05-19 15:16    37  ******************
 118    2026-05-19 16:50    35  ****************
 119    2026-05-19 18:24    35  ****************
 120    2026-05-19 19:58    34  ***************
 121    2026-05-19 21:32    34  ***************
 122    2026-05-19 23:06    34  ***************
 123    2026-05-20 00:40    33  **************
 124    2026-05-20 02:14    33  **************
 125    2026-05-20 03:48    35  ****************
 126    2026-05-20 05:22    36  *****************
 127    2026-05-20 06:56    37  ******************
   0    2026-05-20 08:30    37  ******************
   1    2026-05-20 10:04    38  *******************
   2    2026-05-20 11:38    38  *******************
   3    2026-05-20 13:12    37  ******************
   4    2026-05-20 14:46    36  *****************
   5    2026-05-20 16:20    35  ****************
   6    2026-05-20 17:54    35  ****************
   7    2026-05-20 19:28    34  ***************
   8    2026-05-20 21:02    35  ****************
   9    2026-05-20 22:36    34  ***************
  10    2026-05-21 00:10     ?  -
  11    2026-05-21 01:44    15  -
  12    2026-05-21 03:18    28  *********
  13    2026-05-21 04:52    28  *********
  14    2026-05-21 06:26    29  **********
  15    2026-05-21 08:00    29  **********
  16    2026-05-21 09:34    30  ***********
  17    2026-05-21 11:08    31  ************
  18    2026-05-21 12:42    31  ************
  19    2026-05-21 14:16    30  ***********
  20    2026-05-21 15:50    31  ************
  21    2026-05-21 17:24    32  *************
  22    2026-05-21 18:58    29  **********
  23    2026-05-21 20:32    27  ********
 ...    ..(  4 skipped).    ..  ********
  28    2026-05-22 04:22    27  ********
  29    2026-05-22 05:56    26  *******
  30    2026-05-22 07:30    27  ********
  31    2026-05-22 09:04    30  ***********
  32    2026-05-22 10:38    31  ************
  33    2026-05-22 12:12    32  *************
  34    2026-05-22 13:46    33  **************
  35    2026-05-22 15:20    29  **********
  36    2026-05-22 16:54    28  *********
  37    2026-05-22 18:28    33  **************
  38    2026-05-22 20:02    33  **************
  39    2026-05-22 21:36    34  ***************
 ...    ..(  2 skipped).    ..  ***************
  42    2026-05-23 02:18    34  ***************
  43    2026-05-23 03:52    27  ********
  44    2026-05-23 05:26    31  ************
  45    2026-05-23 07:00    33  **************
  46    2026-05-23 08:34    33  **************
  47    2026-05-23 10:08    34  ***************
  48    2026-05-23 11:42    35  ****************
  49    2026-05-23 13:16    35  ****************
  50    2026-05-23 14:50    30  ***********
  51    2026-05-23 16:24    28  *********
  52    2026-05-23 17:58    28  *********
  53    2026-05-23 19:32    27  ********
  54    2026-05-23 21:06    27  ********
  55    2026-05-23 22:40    27  ********
  56    2026-05-24 00:14    26  *******
  57    2026-05-24 01:48    27  ********
  58    2026-05-24 03:22    27  ********
  59    2026-05-24 04:56    26  *******
  60    2026-05-24 06:30    27  ********
  61    2026-05-24 08:04    26  *******
  62    2026-05-24 09:38    27  ********
  63    2026-05-24 11:12    29  **********
  64    2026-05-24 12:46    28  *********
  65    2026-05-24 14:20    27  ********
  66    2026-05-24 15:54    26  *******
  67    2026-05-24 17:28    25  ******
  68    2026-05-24 19:02    24  *****
  69    2026-05-24 20:36    26  *******
  70    2026-05-24 22:10    27  ********

SCT Error Recovery Control:
           Read:     70 (7.0 seconds)
          Write:     70 (7.0 seconds)

Device Statistics (GP/SMART Log 0x04) not supported

SATA Phy Event Counters (GP Log 0x11)
ID      Size     Value  Description
0x000a  2            3  Device-to-host register FISes sent due to a COMRESET
0x0001  2            0  Command failed due to ICRC error
0x0003  2            0  R_ERR response for device-to-host data FIS
0x0004  2            0  R_ERR response for host-to-device data FIS
0x0006  2            0  R_ERR response for device-to-host non-data FIS
0x0007  2            0  R_ERR response for host-to-device non-data FIS

