[sudo] password for robert: 
smartctl 6.6 2016-05-31 r4324 [x86_64-linux-4.15.0-213-generic] (local build)
Copyright (C) 2002-16, Bruce Allen, Christian Franke, www.smartmontools.org

=== START OF INFORMATION SECTION ===
Model Family:     Western Digital Red
Device Model:     WDC WD20EFRX-68EUZN0
Serial Number:    WD-WCC4M7YANCD5
LU WWN Device Id: 5 0014ee 2615c6a17
Firmware Version: 82.00A82
User Capacity:    2,000,398,934,016 bytes [2.00 TB]
Sector Sizes:     512 bytes logical, 4096 bytes physical
Rotation Rate:    5400 rpm
Device is:        In smartctl database [for details use: -P show]
ATA Version is:   ACS-2 (minor revision not indicated)
SATA Version is:  SATA 3.0, 6.0 Gb/s (current: 6.0 Gb/s)
Local Time is:    Sun May 24 22:52:15 2026 NZST
SMART support is: Available - device has SMART capability.
SMART support is: Enabled
AAM feature is:   Unavailable
APM feature is:   Unavailable
Rd look-ahead is: Enabled
Write cache is:   Enabled
ATA Security is:  Disabled, frozen [SEC2]
Wt Cache Reorder: Enabled

=== START OF READ SMART DATA SECTION ===
SMART overall-health self-assessment test result: PASSED

General SMART Values:
Offline data collection status:  (0x00)	Offline data collection activity
					was never started.
					Auto Offline Data Collection: Disabled.
Self-test execution status:      (   0)	The previous self-test routine completed
					without error or no self-test has ever 
					been run.
Total time to complete Offline 
data collection: 		(26880) seconds.
Offline data collection
capabilities: 			 (0x7b) SMART execute Offline immediate.
					Auto Offline data collection on/off support.
					Suspend Offline collection upon new
					command.
					Offline surface scan supported.
					Self-test supported.
					Conveyance Self-test supported.
					Selective Self-test supported.
SMART capabilities:            (0x0003)	Saves SMART data before entering
					power-saving mode.
					Supports SMART auto save timer.
Error logging capability:        (0x01)	Error logging supported.
					General Purpose Logging supported.
Short self-test routine 
recommended polling time: 	 (   2) minutes.
Extended self-test routine
recommended polling time: 	 ( 271) minutes.
Conveyance self-test routine
recommended polling time: 	 (   5) minutes.
SCT capabilities: 	       (0x703d)	SCT Status supported.
					SCT Error Recovery Control supported.
					SCT Feature Control supported.
					SCT Data Table supported.

SMART Attributes Data Structure revision number: 16
Vendor Specific SMART Attributes with Thresholds:
ID# ATTRIBUTE_NAME          FLAGS    VALUE WORST THRESH FAIL RAW_VALUE
  1 Raw_Read_Error_Rate     POSR-K   200   200   051    -    0
  3 Spin_Up_Time            POS--K   175   173   021    -    4250
  4 Start_Stop_Count        -O--CK   024   024   000    -    76659
  5 Reallocated_Sector_Ct   PO--CK   200   200   140    -    0
  7 Seek_Error_Rate         -OSR-K   100   253   000    -    0
  9 Power_On_Hours          -O--CK   023   023   000    -    56393
 10 Spin_Retry_Count        -O--CK   100   100   000    -    0
 11 Calibration_Retry_Count -O--CK   100   100   000    -    0
 12 Power_Cycle_Count       -O--CK   024   024   000    -    76659
192 Power-Off_Retract_Count -O--CK   098   098   000    -    76579
193 Load_Cycle_Count        -O--CK   200   200   000    -    1068
194 Temperature_Celsius     -O---K   120   102   000    -    27
196 Reallocated_Event_Count -O--CK   200   200   000    -    0
197 Current_Pending_Sector  -O--CK   200   200   000    -    0
198 Offline_Uncorrectable   ----CK   100   253   000    -    0
199 UDMA_CRC_Error_Count    -O--CK   200   200   000    -    0
200 Multi_Zone_Error_Rate   ---R--   200   200   000    -    0
                            ||||||_ K auto-keep
                            |||||__ C event count
                            ||||___ R error rate
                            |||____ S speed/performance
                            ||_____ O updated online
                            |______ P prefailure warning

General Purpose Log Directory Version 1
SMART           Log Directory Version 1 [multi-sector log support]
Address    Access  R/W   Size  Description
0x00       GPL,SL  R/O      1  Log Directory
0x01           SL  R/O      1  Summary SMART error log
0x02           SL  R/O      5  Comprehensive SMART error log
0x03       GPL     R/O      6  Ext. Comprehensive SMART error log
0x06           SL  R/O      1  SMART self-test log
0x07       GPL     R/O      1  Extended self-test log
0x09           SL  R/W      1  Selective self-test log
0x10       GPL     R/O      1  SATA NCQ Queued Error log
0x11       GPL     R/O      1  SATA Phy Event Counters log
0x21       GPL     R/O      1  Write stream error log
0x22       GPL     R/O      1  Read stream error log
0x80-0x9f  GPL,SL  R/W     16  Host vendor specific log
0xa0-0xa7  GPL,SL  VS      16  Device vendor specific log
0xa8-0xb7  GPL,SL  VS       1  Device vendor specific log
0xbd       GPL,SL  VS       1  Device vendor specific log
0xc0       GPL,SL  VS       1  Device vendor specific log
0xc1       GPL     VS      93  Device vendor specific log
0xe0       GPL,SL  R/W      1  SCT Command/Status
0xe1       GPL,SL  R/W      1  SCT Data Transfer

SMART Extended Comprehensive Error Log Version: 1 (6 sectors)
No Errors Logged

SMART Extended Self-test Log Version: 1 (1 sectors)
Num  Test_Description    Status                  Remaining  LifeTime(hours)  LBA_of_first_error
# 1  Extended offline    Completed without error       00%     56306         -
# 2  Short offline       Completed without error       00%     55059         -
# 3  Short offline       Completed without error       00%     54316         -
# 4  Short offline       Completed without error       00%     53573         -
# 5  Short offline       Completed without error       00%     52854         -
# 6  Short offline       Completed without error       00%     52110         -
# 7  Short offline       Completed without error       00%     51391         -
# 8  Short offline       Completed without error       00%     50647         -
# 9  Short offline       Completed without error       00%     49976         -
#10  Short offline       Completed without error       00%     49232         -
#11  Short offline       Completed without error       00%     48489         -
#12  Short offline       Completed without error       00%     47770         -
#13  Short offline       Completed without error       00%     47027         -
#14  Short offline       Completed without error       00%     46308         -
#15  Short offline       Completed without error       00%     45565         -
#16  Short offline       Completed without error       00%     44822         -
#17  Short offline       Completed without error       00%     44103         -
#18  Short offline       Completed without error       00%     43359         -

SMART Selective self-test log data structure revision number 1
 SPAN  MIN_LBA  MAX_LBA  CURRENT_TEST_STATUS
    1        0        0  Not_testing
    2        0        0  Not_testing
    3        0        0  Not_testing
    4        0        0  Not_testing
    5        0        0  Not_testing
Selective self-test flags (0x0):
  After scanning selected spans, do NOT read-scan remainder of disk.
If Selective self-test is pending on power-up, resume after 0 minute delay.

SCT Status Version:                  3
SCT Version (vendor specific):       258 (0x0102)
SCT Support Level:                   1
Device State:                        Active (0)
Current Temperature:                    27 Celsius
Power Cycle Min/Max Temperature:     18/35 Celsius
Lifetime    Min/Max Temperature:      2/45 Celsius
Under/Over Temperature Limit Count:   0/0
Vendor specific:
01 00 00 00 00 00 00 00 00 00 00 00 00 00 00 00
00 00 00 00 00 00 00 00 00 00 00 00 00 00 00 00

SCT Temperature History Version:     2
Temperature Sampling Period:         1 minute
Temperature Logging Interval:        1 minute
Min/Max recommended Temperature:      0/60 Celsius
Min/Max Temperature Limit:           -41/85 Celsius
Temperature History Size (Index):    478 (36)

Index    Estimated Time   Temperature Celsius
  37    2026-05-24 14:55    22  ***
 ...    ..( 25 skipped).    ..  ***
  63    2026-05-24 15:21    22  ***
  64    2026-05-24 15:22    23  ****
 ...    ..(  2 skipped).    ..  ****
  67    2026-05-24 15:25    23  ****
  68    2026-05-24 15:26    22  ***
 ...    ..(  6 skipped).    ..  ***
  75    2026-05-24 15:33    22  ***
  76    2026-05-24 15:34    23  ****
 ...    ..(  4 skipped).    ..  ****
  81    2026-05-24 15:39    23  ****
  82    2026-05-24 15:40    22  ***
 ...    ..( 56 skipped).    ..  ***
 139    2026-05-24 16:37    22  ***
 140    2026-05-24 16:38    23  ****
 ...    ..(  7 skipped).    ..  ****
 148    2026-05-24 16:46    23  ****
 149    2026-05-24 16:47    24  *****
 ...    ..( 23 skipped).    ..  *****
 173    2026-05-24 17:11    24  *****
 174    2026-05-24 17:12    25  ******
 ...    ..( 23 skipped).    ..  ******
 198    2026-05-24 17:36    25  ******
 199    2026-05-24 17:37    26  *******
 ...    ..( 34 skipped).    ..  *******
 234    2026-05-24 18:12    26  *******
 235    2026-05-24 18:13    27  ********
 ...    ..(146 skipped).    ..  ********
 382    2026-05-24 20:40    27  ********
 383    2026-05-24 20:41    26  *******
 ...    ..( 55 skipped).    ..  *******
 439    2026-05-24 21:37    26  *******
 440    2026-05-24 21:38    25  ******
 ...    ..( 31 skipped).    ..  ******
 472    2026-05-24 22:10    25  ******
 473    2026-05-24 22:11    24  *****
 ...    ..( 11 skipped).    ..  *****
   7    2026-05-24 22:23    24  *****
   8    2026-05-24 22:24    23  ****
 ...    ..( 25 skipped).    ..  ****
  34    2026-05-24 22:50    23  ****
  35    2026-05-24 22:51    22  ***
  36    2026-05-24 22:52    22  ***

SCT Error Recovery Control:
           Read:     70 (7.0 seconds)
          Write:     70 (7.0 seconds)

Device Statistics (GP/SMART Log 0x04) not supported

SATA Phy Event Counters (GP Log 0x11)
ID      Size     Value  Description
0x0001  2            0  Command failed due to ICRC error
0x0002  2            0  R_ERR response for data FIS
0x0003  2            0  R_ERR response for device-to-host data FIS
0x0004  2            0  R_ERR response for host-to-device data FIS
0x0005  2            0  R_ERR response for non-data FIS
0x0006  2            0  R_ERR response for device-to-host non-data FIS
0x0007  2            0  R_ERR response for host-to-device non-data FIS
0x0008  2            0  Device-to-host non-data FIS retries
0x0009  2            2  Transition from drive PhyRdy to drive PhyNRdy
0x000a  2            3  Device-to-host register FISes sent due to a COMRESET
0x000b  2            0  CRC errors within host-to-device FIS
0x000f  2            0  R_ERR response for host-to-device data FIS, CRC
0x0012  2            0  R_ERR response for host-to-device non-data FIS, CRC
0x8000  4       334939  Vendor specific

