[sudo] password for robert: 
smartctl 6.6 2016-05-31 r4324 [x86_64-linux-4.15.0-213-generic] (local build)
Copyright (C) 2002-16, Bruce Allen, Christian Franke, www.smartmontools.org

=== START OF INFORMATION SECTION ===
Model Family:     Western Digital Red
Device Model:     WDC WD20EFRX-68EUZN0
Serial Number:    WD-WCC4M1RYFSH9
LU WWN Device Id: 5 0014ee 2615c6c3c
Firmware Version: 82.00A82
User Capacity:    2,000,398,934,016 bytes [2.00 TB]
Sector Sizes:     512 bytes logical, 4096 bytes physical
Rotation Rate:    5400 rpm
Device is:        In smartctl database [for details use: -P show]
ATA Version is:   ACS-2 (minor revision not indicated)
SATA Version is:  SATA 3.0, 6.0 Gb/s (current: 6.0 Gb/s)
Local Time is:    Sun May 24 22:52:14 2026 NZST
SMART support is: Available - device has SMART capability.
SMART support is: Enabled
AAM feature is:   Unavailable
APM feature is:   Unavailable
Rd look-ahead is: Enabled
Write cache is:   Enabled
ATA Security is:  Disabled, frozen [SEC2]
Wt Cache Reorder: Enabled

=== START OF READ SMART DATA SECTION ===
SMART overall-health self-assessment test result: PASSED

General SMART Values:
Offline data collection status:  (0x00)	Offline data collection activity
					was never started.
					Auto Offline Data Collection: Disabled.
Self-test execution status:      (   0)	The previous self-test routine completed
					without error or no self-test has ever 
					been run.
Total time to complete Offline 
data collection: 		(26280) seconds.
Offline data collection
capabilities: 			 (0x7b) SMART execute Offline immediate.
					Auto Offline data collection on/off support.
					Suspend Offline collection upon new
					command.
					Offline surface scan supported.
					Self-test supported.
					Conveyance Self-test supported.
					Selective Self-test supported.
SMART capabilities:            (0x0003)	Saves SMART data before entering
					power-saving mode.
					Supports SMART auto save timer.
Error logging capability:        (0x01)	Error logging supported.
					General Purpose Logging supported.
Short self-test routine 
recommended polling time: 	 (   2) minutes.
Extended self-test routine
recommended polling time: 	 ( 266) minutes.
Conveyance self-test routine
recommended polling time: 	 (   5) minutes.
SCT capabilities: 	       (0x703d)	SCT Status supported.
					SCT Error Recovery Control supported.
					SCT Feature Control supported.
					SCT Data Table supported.

SMART Attributes Data Structure revision number: 16
Vendor Specific SMART Attributes with Thresholds:
ID# ATTRIBUTE_NAME          FLAGS    VALUE WORST THRESH FAIL RAW_VALUE
  1 Raw_Read_Error_Rate     POSR-K   200   200   051    -    46
  3 Spin_Up_Time            POS--K   176   174   021    -    4166
  4 Start_Stop_Count        -O--CK   024   024   000    -    76660
  5 Reallocated_Sector_Ct   PO--CK   200   200   140    -    0
  7 Seek_Error_Rate         -OSR-K   100   253   000    -    0
  9 Power_On_Hours          -O--CK   023   023   000    -    56393
 10 Spin_Retry_Count        -O--CK   100   100   000    -    0
 11 Calibration_Retry_Count -O--CK   100   100   000    -    0
 12 Power_Cycle_Count       -O--CK   024   024   000    -    76659
192 Power-Off_Retract_Count -O--CK   098   098   000    -    76580
193 Load_Cycle_Count        -O--CK   200   200   000    -    1175
194 Temperature_Celsius     -O---K   120   103   000    -    27
196 Reallocated_Event_Count -O--CK   200   200   000    -    0
197 Current_Pending_Sector  -O--CK   200   200   000    -    0
198 Offline_Uncorrectable   ----CK   100   253   000    -    0
199 UDMA_CRC_Error_Count    -O--CK   200   200   000    -    0
200 Multi_Zone_Error_Rate   ---R--   200   200   000    -    0
                            ||||||_ K auto-keep
                            |||||__ C event count
                            ||||___ R error rate
                            |||____ S speed/performance
                            ||_____ O updated online
                            |______ P prefailure warning

General Purpose Log Directory Version 1
SMART           Log Directory Version 1 [multi-sector log support]
Address    Access  R/W   Size  Description
0x00       GPL,SL  R/O      1  Log Directory
0x01           SL  R/O      1  Summary SMART error log
0x02           SL  R/O      5  Comprehensive SMART error log
0x03       GPL     R/O      6  Ext. Comprehensive SMART error log
0x06           SL  R/O      1  SMART self-test log
0x07       GPL     R/O      1  Extended self-test log
0x09           SL  R/W      1  Selective self-test log
0x10       GPL     R/O      1  SATA NCQ Queued Error log
0x11       GPL     R/O      1  SATA Phy Event Counters log
0x21       GPL     R/O      1  Write stream error log
0x22       GPL     R/O      1  Read stream error log
0x80-0x9f  GPL,SL  R/W     16  Host vendor specific log
0xa0-0xa7  GPL,SL  VS      16  Device vendor specific log
0xa8-0xb7  GPL,SL  VS       1  Device vendor specific log
0xbd       GPL,SL  VS       1  Device vendor specific log
0xc0       GPL,SL  VS       1  Device vendor specific log
0xc1       GPL     VS      93  Device vendor specific log
0xe0       GPL,SL  R/W      1  SCT Command/Status
0xe1       GPL,SL  R/W      1  SCT Data Transfer

SMART Extended Comprehensive Error Log Version: 1 (6 sectors)
Device Error Count: 33 (device log contains only the most recent 24 errors)
	CR     = Command Register
	FEATR  = Features Register
	COUNT  = Count (was: Sector Count) Register
	LBA_48 = Upper bytes of LBA High/Mid/Low Registers ]  ATA-8
	LH     = LBA High (was: Cylinder High) Register    ]   LBA
	LM     = LBA Mid (was: Cylinder Low) Register      ] Register
	LL     = LBA Low (was: Sector Number) Register     ]
	DV     = Device (was: Device/Head) Register
	DC     = Device Control Register
	ER     = Error register
	ST     = Status register
Powered_Up_Time is measured from power on, and printed as
DDd+hh:mm:SS.sss where DD=days, hh=hours, mm=minutes,
SS=sec, and sss=millisec. It "wraps" after 49.710 days.

Error 33 [8] occurred at disk power-on lifetime: 56316 hours (2346 days + 12 hours)
  When the command that caused the error occurred, the device was active or idle.

  After command completion occurred, registers were:
  ER -- ST COUNT  LBA_48  LH LM LL DV DC
  -- -- -- == -- == == == -- -- -- -- --
  40 -- 51 00 00 00 00 11 70 0b 18 40 00  Error: UNC at LBA = 0x11700b18 = 292555544

  Commands leading to the command that caused the error were:
  CR FEATR COUNT  LBA_48  LH LM LL DV DC  Powered_Up_Time  Command/Feature_Name
  -- == -- == -- == == == -- -- -- -- --  ---------------  --------------------
  60 00 08 00 c8 00 00 11 70 0b 18 40 08     16:33:07.885  READ FPDMA QUEUED
  ef 00 10 00 02 00 00 00 00 00 00 a0 08     16:33:07.885  SET FEATURES [Enable SATA feature]
  27 00 00 00 00 00 00 00 00 00 00 e0 08     16:33:07.885  READ NATIVE MAX ADDRESS EXT [OBS-ACS-3]
  ec 00 00 00 00 00 00 00 00 00 00 a0 08     16:33:07.885  IDENTIFY DEVICE
  ef 00 03 00 46 00 00 00 00 00 00 a0 08     16:33:07.885  SET FEATURES [Set transfer mode]

Error 32 [7] occurred at disk power-on lifetime: 56316 hours (2346 days + 12 hours)
  When the command that caused the error occurred, the device was active or idle.

  After command completion occurred, registers were:
  ER -- ST COUNT  LBA_48  LH LM LL DV DC
  -- -- -- == -- == == == -- -- -- -- --
  40 -- 51 00 00 00 00 11 70 0b 10 40 00  Error: UNC at LBA = 0x11700b10 = 292555536

  Commands leading to the command that caused the error were:
  CR FEATR COUNT  LBA_48  LH LM LL DV DC  Powered_Up_Time  Command/Feature_Name
  -- == -- == -- == == == -- -- -- -- --  ---------------  --------------------
  60 00 08 00 60 00 00 11 70 0b 10 40 08     16:33:04.399  READ FPDMA QUEUED
  60 00 08 00 58 00 00 11 70 0b 08 40 08     16:33:04.399  READ FPDMA QUEUED
  60 00 08 00 50 00 00 11 70 0b 00 40 08     16:33:04.399  READ FPDMA QUEUED
  60 00 08 00 48 00 00 11 70 0a f8 40 08     16:33:04.399  READ FPDMA QUEUED
  60 00 08 00 40 00 00 11 70 0a f0 40 08     16:33:04.399  READ FPDMA QUEUED

Error 31 [6] occurred at disk power-on lifetime: 56316 hours (2346 days + 12 hours)
  When the command that caused the error occurred, the device was active or idle.

  After command completion occurred, registers were:
  ER -- ST COUNT  LBA_48  LH LM LL DV DC
  -- -- -- == -- == == == -- -- -- -- --
  40 -- 51 00 00 00 00 11 70 0b 10 40 00  Error: UNC at LBA = 0x11700b10 = 292555536

  Commands leading to the command that caused the error were:
  CR FEATR COUNT  LBA_48  LH LM LL DV DC  Powered_Up_Time  Command/Feature_Name
  -- == -- == -- == == == -- -- -- -- --  ---------------  --------------------
  60 0a 00 00 60 00 00 11 70 f0 00 40 08     16:32:52.862  READ FPDMA QUEUED
  60 06 00 00 58 00 00 11 70 ea 00 40 08     16:32:52.862  READ FPDMA QUEUED
  60 0a 00 00 50 00 00 11 70 e0 00 40 08     16:32:52.857  READ FPDMA QUEUED
  60 06 00 00 48 00 00 11 70 da 00 40 08     16:32:52.848  READ FPDMA QUEUED
  60 0a 00 00 40 00 00 11 70 d0 00 40 08     16:32:52.843  READ FPDMA QUEUED

Error 30 [5] occurred at disk power-on lifetime: 56316 hours (2346 days + 12 hours)
  When the command that caused the error occurred, the device was active or idle.

  After command completion occurred, registers were:
  ER -- ST COUNT  LBA_48  LH LM LL DV DC
  -- -- -- == -- == == == -- -- -- -- --
  40 -- 51 00 00 00 00 0c 9d 87 60 40 00  Error: UNC at LBA = 0x0c9d8760 = 211650400

  Commands leading to the command that caused the error were:
  CR FEATR COUNT  LBA_48  LH LM LL DV DC  Powered_Up_Time  Command/Feature_Name
  -- == -- == -- == == == -- -- -- -- --  ---------------  --------------------
  60 00 08 00 08 00 00 0c 9d 87 60 40 08     16:28:10.589  READ FPDMA QUEUED
  60 00 08 00 00 00 00 0c 9d 87 58 40 08     16:28:10.589  READ FPDMA QUEUED
  60 00 08 00 f0 00 00 0c 9d 87 50 40 08     16:28:10.589  READ FPDMA QUEUED
  60 00 08 00 e8 00 00 0c 9d 87 48 40 08     16:28:10.589  READ FPDMA QUEUED
  60 00 08 00 e0 00 00 0c 9d 87 40 40 08     16:28:10.589  READ FPDMA QUEUED

Error 29 [4] occurred at disk power-on lifetime: 56316 hours (2346 days + 12 hours)
  When the command that caused the error occurred, the device was active or idle.

  After command completion occurred, registers were:
  ER -- ST COUNT  LBA_48  LH LM LL DV DC
  -- -- -- == -- == == == -- -- -- -- --
  40 -- 51 00 00 00 00 0c 9d b9 f0 40 00  Error: UNC at LBA = 0x0c9db9f0 = 211663344

  Commands leading to the command that caused the error were:
  CR FEATR COUNT  LBA_48  LH LM LL DV DC  Powered_Up_Time  Command/Feature_Name
  -- == -- == -- == == == -- -- -- -- --  ---------------  --------------------
  60 0a 00 00 88 00 00 0c 9f f0 00 40 08     16:27:55.407  READ FPDMA QUEUED
  60 06 00 00 a0 00 00 0c 9f ea 00 40 08     16:27:55.393  READ FPDMA QUEUED
  60 0a 00 00 a8 00 00 0c 9f e0 00 40 08     16:27:55.388  READ FPDMA QUEUED
  60 06 00 00 80 00 00 0c 9f da 00 40 08     16:27:55.388  READ FPDMA QUEUED
  60 0a 00 00 88 00 00 0c 9f d0 00 40 08     16:27:55.379  READ FPDMA QUEUED

Error 28 [3] occurred at disk power-on lifetime: 56316 hours (2346 days + 12 hours)
  When the command that caused the error occurred, the device was active or idle.

  After command completion occurred, registers were:
  ER -- ST COUNT  LBA_48  LH LM LL DV DC
  -- -- -- == -- == == == -- -- -- -- --
  40 -- 51 00 00 00 00 0c 9d 87 60 40 00  Error: UNC at LBA = 0x0c9d8760 = 211650400

  Commands leading to the command that caused the error were:
  CR FEATR COUNT  LBA_48  LH LM LL DV DC  Powered_Up_Time  Command/Feature_Name
  -- == -- == -- == == == -- -- -- -- --  ---------------  --------------------
  60 06 00 00 b8 00 00 0c 9e 6a 00 40 08     16:27:51.396  READ FPDMA QUEUED
  60 0a 00 00 b0 00 00 0c 9e 60 00 40 08     16:27:51.396  READ FPDMA QUEUED
  60 06 00 00 a8 00 00 0c 9e 5a 00 40 08     16:27:51.386  READ FPDMA QUEUED
  60 0a 00 00 a0 00 00 0c 9e 50 00 40 08     16:27:51.380  READ FPDMA QUEUED
  60 06 00 00 98 00 00 0c 9e 4a 00 40 08     16:27:51.372  READ FPDMA QUEUED

Error 27 [2] occurred at disk power-on lifetime: 56316 hours (2346 days + 12 hours)
  When the command that caused the error occurred, the device was active or idle.

  After command completion occurred, registers were:
  ER -- ST COUNT  LBA_48  LH LM LL DV DC
  -- -- -- == -- == == == -- -- -- -- --
  40 -- 51 00 00 00 00 0c 4e 03 a8 40 00  Error: UNC at LBA = 0x0c4e03a8 = 206439336

  Commands leading to the command that caused the error were:
  CR FEATR COUNT  LBA_48  LH LM LL DV DC  Powered_Up_Time  Command/Feature_Name
  -- == -- == -- == == == -- -- -- -- --  ---------------  --------------------
  60 00 08 00 90 00 00 0c 4e 03 a8 40 08     16:27:27.643  READ FPDMA QUEUED
  60 00 08 00 88 00 00 0c 4e 03 a0 40 08     16:27:27.643  READ FPDMA QUEUED
  60 00 08 00 80 00 00 0c 4e 03 98 40 08     16:27:27.643  READ FPDMA QUEUED
  60 00 08 00 78 00 00 0c 4e 03 90 40 08     16:27:27.643  READ FPDMA QUEUED
  60 00 08 00 70 00 00 0c 4e 03 88 40 08     16:27:27.643  READ FPDMA QUEUED

Error 26 [1] occurred at disk power-on lifetime: 56316 hours (2346 days + 12 hours)
  When the command that caused the error occurred, the device was active or idle.

  After command completion occurred, registers were:
  ER -- ST COUNT  LBA_48  LH LM LL DV DC
  -- -- -- == -- == == == -- -- -- -- --
  40 -- 51 00 00 00 00 0c 4c fe f0 40 00  Error: UNC at LBA = 0x0c4cfef0 = 206372592

  Commands leading to the command that caused the error were:
  CR FEATR COUNT  LBA_48  LH LM LL DV DC  Powered_Up_Time  Command/Feature_Name
  -- == -- == -- == == == -- -- -- -- --  ---------------  --------------------
  60 00 08 00 d0 00 00 0c 4c fe f0 40 08     16:27:23.838  READ FPDMA QUEUED
  60 00 08 00 c8 00 00 0c 4c fe e8 40 08     16:27:23.838  READ FPDMA QUEUED
  60 00 08 00 c0 00 00 0c 4c fe e0 40 08     16:27:23.838  READ FPDMA QUEUED
  60 00 08 00 b8 00 00 0c 4c fe d8 40 08     16:27:23.838  READ FPDMA QUEUED
  60 00 08 00 b0 00 00 0c 4c fe d0 40 08     16:27:23.838  READ FPDMA QUEUED

SMART Extended Self-test Log Version: 1 (1 sectors)
Num  Test_Description    Status                  Remaining  LifeTime(hours)  LBA_of_first_error
# 1  Extended offline    Completed without error       00%     56305         -
# 2  Short offline       Completed without error       00%     55059         -
# 3  Short offline       Completed without error       00%     54315         -
# 4  Short offline       Completed without error       00%     53572         -
# 5  Short offline       Completed without error       00%     52853         -
# 6  Short offline       Completed without error       00%     52110         -
# 7  Short offline       Completed without error       00%     51390         -
# 8  Short offline       Completed without error       00%     50646         -
# 9  Short offline       Completed without error       00%     49975         -
#10  Short offline       Completed without error       00%     49232         -
#11  Short offline       Completed without error       00%     48488         -
#12  Short offline       Completed without error       00%     47769         -
#13  Short offline       Completed without error       00%     47026         -
#14  Short offline       Completed without error       00%     46308         -
#15  Short offline       Completed without error       00%     45564         -
#16  Short offline       Completed without error       00%     44821         -
#17  Short offline       Completed without error       00%     44102         -
#18  Short offline       Completed without error       00%     43359         -

SMART Selective self-test log data structure revision number 1
 SPAN  MIN_LBA  MAX_LBA  CURRENT_TEST_STATUS
    1        0        0  Not_testing
    2        0        0  Not_testing
    3        0        0  Not_testing
    4        0        0  Not_testing
    5        0        0  Not_testing
Selective self-test flags (0x0):
  After scanning selected spans, do NOT read-scan remainder of disk.
If Selective self-test is pending on power-up, resume after 0 minute delay.

SCT Status Version:                  3
SCT Version (vendor specific):       258 (0x0102)
SCT Support Level:                   1
Device State:                        Active (0)
Current Temperature:                    27 Celsius
Power Cycle Min/Max Temperature:     18/35 Celsius
Lifetime    Min/Max Temperature:     18/44 Celsius
Under/Over Temperature Limit Count:   0/0
Vendor specific:
01 00 00 00 00 00 00 00 00 00 00 00 00 00 00 00
00 00 00 00 00 00 00 00 00 00 00 00 00 00 00 00

SCT Temperature History Version:     2
Temperature Sampling Period:         1 minute
Temperature Logging Interval:        1 minute
Min/Max recommended Temperature:      0/60 Celsius
Min/Max Temperature Limit:           -41/85 Celsius
Temperature History Size (Index):    478 (16)

Index    Estimated Time   Temperature Celsius
  17    2026-05-24 14:55    22  ***
 ...    ..(102 skipped).    ..  ***
 120    2026-05-24 16:38    22  ***
 121    2026-05-24 16:39    23  ****
 ...    ..(  7 skipped).    ..  ****
 129    2026-05-24 16:47    23  ****
 130    2026-05-24 16:48    24  *****
 ...    ..( 27 skipped).    ..  *****
 158    2026-05-24 17:16    24  *****
 159    2026-05-24 17:17    25  ******
 ...    ..( 26 skipped).    ..  ******
 186    2026-05-24 17:44    25  ******
 187    2026-05-24 17:45    26  *******
 ...    ..( 38 skipped).    ..  *******
 226    2026-05-24 18:24    26  *******
 227    2026-05-24 18:25    27  ********
 ...    ..( 48 skipped).    ..  ********
 276    2026-05-24 19:14    27  ********
 277    2026-05-24 19:15    25  ******
 ...    ..(149 skipped).    ..  ******
 427    2026-05-24 21:45    25  ******
 428    2026-05-24 21:46    24  *****
 ...    ..( 27 skipped).    ..  *****
 456    2026-05-24 22:14    24  *****
 457    2026-05-24 22:15    23  ****
 ...    ..( 25 skipped).    ..  ****
   5    2026-05-24 22:41    23  ****
   6    2026-05-24 22:42    22  ***
 ...    ..(  9 skipped).    ..  ***
  16    2026-05-24 22:52    22  ***

SCT Error Recovery Control:
           Read:     70 (7.0 seconds)
          Write:     70 (7.0 seconds)

Device Statistics (GP/SMART Log 0x04) not supported

SATA Phy Event Counters (GP Log 0x11)
ID      Size     Value  Description
0x0001  2            0  Command failed due to ICRC error
0x0002  2            0  R_ERR response for data FIS
0x0003  2            0  R_ERR response for device-to-host data FIS
0x0004  2            0  R_ERR response for host-to-device data FIS
0x0005  2            0  R_ERR response for non-data FIS
0x0006  2            0  R_ERR response for device-to-host non-data FIS
0x0007  2            0  R_ERR response for host-to-device non-data FIS
0x0008  2            0  Device-to-host non-data FIS retries
0x0009  2            2  Transition from drive PhyRdy to drive PhyNRdy
0x000a  2            3  Device-to-host register FISes sent due to a COMRESET
0x000b  2            0  CRC errors within host-to-device FIS
0x000f  2            0  R_ERR response for host-to-device data FIS, CRC
0x0012  2            0  R_ERR response for host-to-device non-data FIS, CRC
0x8000  4       334939  Vendor specific

