[sudo] password for robert: 
smartctl 6.6 2016-05-31 r4324 [x86_64-linux-4.15.0-213-generic] (local build)
Copyright (C) 2002-16, Bruce Allen, Christian Franke, www.smartmontools.org

=== START OF INFORMATION SECTION ===
Device Model:     ST2000DM008-2FR102
Serial Number:    WFL3ZBBC
LU WWN Device Id: 5 000c50 0d060d5ea
Firmware Version: 0001
User Capacity:    2,000,398,934,016 bytes [2.00 TB]
Sector Sizes:     512 bytes logical, 4096 bytes physical
Rotation Rate:    7200 rpm
Form Factor:      3.5 inches
Device is:        Not in smartctl database [for details use: -P showall]
ATA Version is:   ACS-3 T13/2161-D revision 5
SATA Version is:  SATA 3.1, 6.0 Gb/s (current: 6.0 Gb/s)
Local Time is:    Mon May 25 13:50:04 2026 NZST
SMART support is: Available - device has SMART capability.
SMART support is: Enabled
AAM feature is:   Unavailable
APM level is:     254 (maximum performance)
Rd look-ahead is: Enabled
Write cache is:   Enabled
ATA Security is:  Disabled, frozen [SEC2]
Wt Cache Reorder: Unavailable

=== START OF READ SMART DATA SECTION ===
SMART overall-health self-assessment test result: PASSED

General SMART Values:
Offline data collection status:  (0x00)	Offline data collection activity
					was never started.
					Auto Offline Data Collection: Disabled.
Self-test execution status:      (   0)	The previous self-test routine completed
					without error or no self-test has ever 
					been run.
Total time to complete Offline 
data collection: 		(    0) seconds.
Offline data collection
capabilities: 			 (0x73) SMART execute Offline immediate.
					Auto Offline data collection on/off support.
					Suspend Offline collection upon new
					command.
					No Offline surface scan supported.
					Self-test supported.
					Conveyance Self-test supported.
					Selective Self-test supported.
SMART capabilities:            (0x0003)	Saves SMART data before entering
					power-saving mode.
					Supports SMART auto save timer.
Error logging capability:        (0x01)	Error logging supported.
					General Purpose Logging supported.
Short self-test routine 
recommended polling time: 	 (   1) minutes.
Extended self-test routine
recommended polling time: 	 ( 198) minutes.
Conveyance self-test routine
recommended polling time: 	 (   2) minutes.
SCT capabilities: 	       (0x30a5)	SCT Status supported.
					SCT Data Table supported.

SMART Attributes Data Structure revision number: 10
Vendor Specific SMART Attributes with Thresholds:
ID# ATTRIBUTE_NAME          FLAGS    VALUE WORST THRESH FAIL RAW_VALUE
  1 Raw_Read_Error_Rate     POSR--   075   064   006    -    31474907
  3 Spin_Up_Time            PO----   098   098   000    -    0
  4 Start_Stop_Count        -O--CK   099   099   020    -    1695
  5 Reallocated_Sector_Ct   PO--CK   100   100   010    -    0
  7 Seek_Error_Rate         POSR--   072   060   045    -    16377844
  9 Power_On_Hours          -O--CK   098   098   000    -    2451 (179 52 0)
 10 Spin_Retry_Count        PO--C-   100   100   097    -    0
 12 Power_Cycle_Count       -O--CK   099   099   020    -    1450
183 Runtime_Bad_Block       -O--CK   100   100   000    -    0
184 End-to-End_Error        -O--CK   100   100   099    -    0
187 Reported_Uncorrect      -O--CK   100   100   000    -    0
188 Command_Timeout         -O--CK   100   100   000    -    0
189 High_Fly_Writes         -O-RCK   100   100   000    -    0
190 Airflow_Temperature_Cel -O---K   067   062   040    -    33 (Min/Max 21/33)
191 G-Sense_Error_Rate      -O--CK   100   100   000    -    0
192 Power-Off_Retract_Count -O--CK   100   100   000    -    27
193 Load_Cycle_Count        -O--CK   100   100   000    -    1725
194 Temperature_Celsius     -O---K   033   040   000    -    33 (0 9 0 0 0)
195 Hardware_ECC_Recovered  -O-RC-   075   064   000    -    31474907
197 Current_Pending_Sector  -O--C-   100   100   000    -    0
198 Offline_Uncorrectable   ----C-   100   100   000    -    0
199 UDMA_CRC_Error_Count    -OSRCK   200   200   000    -    0
240 Head_Flying_Hours       ------   100   253   000    -    1789 (240 161 0)
241 Total_LBAs_Written      ------   100   253   000    -    4001741792
242 Total_LBAs_Read         ------   100   253   000    -    188329149
                            ||||||_ K auto-keep
                            |||||__ C event count
                            ||||___ R error rate
                            |||____ S speed/performance
                            ||_____ O updated online
                            |______ P prefailure warning

General Purpose Log Directory Version 1
SMART           Log Directory Version 1 [multi-sector log support]
Address    Access  R/W   Size  Description
0x00       GPL,SL  R/O      1  Log Directory
0x01           SL  R/O      1  Summary SMART error log
0x02           SL  R/O      5  Comprehensive SMART error log
0x03       GPL     R/O      5  Ext. Comprehensive SMART error log
0x04       GPL,SL  R/O      8  Device Statistics log
0x06           SL  R/O      1  SMART self-test log
0x07       GPL     R/O      1  Extended self-test log
0x09           SL  R/W      1  Selective self-test log
0x0c       GPL     R/O   2048  Pending Defects log
0x10       GPL     R/O      1  SATA NCQ Queued Error log
0x11       GPL     R/O      1  SATA Phy Event Counters log
0x21       GPL     R/O      1  Write stream error log
0x22       GPL     R/O      1  Read stream error log
0x24       GPL     R/O    512  Current Device Internal Status Data log
0x30       GPL,SL  R/O      9  IDENTIFY DEVICE data log
0x80-0x9f  GPL,SL  R/W     16  Host vendor specific log
0xa1       GPL,SL  VS      24  Device vendor specific log
0xa2       GPL     VS    8160  Device vendor specific log
0xa6       GPL     VS     192  Device vendor specific log
0xa8-0xa9  GPL,SL  VS     136  Device vendor specific log
0xab       GPL     VS       1  Device vendor specific log
0xb0       GPL     VS    9048  Device vendor specific log
0xbd       GPL     VS       8  Device vendor specific log
0xbe-0xbf  GPL     VS   65535  Device vendor specific log
0xc0       GPL,SL  VS       1  Device vendor specific log
0xc1       GPL,SL  VS      16  Device vendor specific log
0xc3       GPL,SL  VS       8  Device vendor specific log
0xc4       GPL,SL  VS      24  Device vendor specific log
0xd1       GPL     VS     264  Device vendor specific log
0xd3       GPL     VS    1920  Device vendor specific log
0xe0       GPL,SL  R/W      1  SCT Command/Status
0xe1       GPL,SL  R/W      1  SCT Data Transfer

SMART Extended Comprehensive Error Log Version: 1 (5 sectors)
No Errors Logged

SMART Extended Self-test Log Version: 1 (1 sectors)
Num  Test_Description    Status                  Remaining  LifeTime(hours)  LBA_of_first_error
# 1  Conveyance offline  Completed without error       00%      2451         -
# 2  Extended offline    Completed without error       00%      2444         -
# 3  Extended offline    Completed without error       00%      2316         -
# 4  Short offline       Completed without error       00%      2311         -
# 5  Short offline       Completed without error       00%      1577         -
# 6  Extended offline    Completed without error       00%      1515         -
# 7  Short offline       Completed without error       00%      1451         -
# 8  Short offline       Completed without error       00%      1370         -
# 9  Short offline       Completed without error       00%      1260         -
#10  Short offline       Completed without error       00%      1115         -
#11  Short offline       Completed without error       00%       883         -
#12  Extended offline    Completed without error       00%       724         -
#13  Short offline       Completed without error       00%       651         -
#14  Short offline       Completed without error       00%       551         -
#15  Short offline       Completed without error       00%       146         -
#16  Short offline       Completed without error       00%        80         -

SMART Selective self-test log data structure revision number 1
 SPAN  MIN_LBA  MAX_LBA  CURRENT_TEST_STATUS
    1        0        0  Not_testing
    2        0        0  Not_testing
    3        0        0  Not_testing
    4        0        0  Not_testing
    5        0        0  Not_testing
Selective self-test flags (0x0):
  After scanning selected spans, do NOT read-scan remainder of disk.
If Selective self-test is pending on power-up, resume after 0 minute delay.

SCT Status Version:                  3
SCT Version (vendor specific):       522 (0x020a)
SCT Support Level:                   1
Device State:                        Active (0)
Current Temperature:                    33 Celsius
Power Cycle Min/Max Temperature:     21/33 Celsius
Lifetime    Min/Max Temperature:      9/39 Celsius
Under/Over Temperature Limit Count:   0/0

SCT Temperature History Version:     2
Temperature Sampling Period:         3 minutes
Temperature Logging Interval:        59 minutes
Min/Max recommended Temperature:     14/55 Celsius
Min/Max Temperature Limit:           10/60 Celsius
Temperature History Size (Index):    128 (37)

Index    Estimated Time   Temperature Celsius
  38    2026-05-20 08:15    30  ***********
  39    2026-05-20 09:14    30  ***********
  40    2026-05-20 10:13    31  ************
  41    2026-05-20 11:12    32  *************
 ...    ..(  5 skipped).    ..  *************
  47    2026-05-20 17:06    32  *************
  48    2026-05-20 18:05    33  **************
  49    2026-05-20 19:04    32  *************
  50    2026-05-20 20:03    33  **************
 ...    ..(  2 skipped).    ..  **************
  53    2026-05-20 23:00    33  **************
  54    2026-05-20 23:59    32  *************
 ...    ..(  4 skipped).    ..  *************
  59    2026-05-21 04:54    32  *************
  60    2026-05-21 05:53     ?  -
  61    2026-05-21 06:52    24  *****
  62    2026-05-21 07:51     ?  -
  63    2026-05-21 08:50    26  *******
  64    2026-05-21 09:49    39  ********************
  65    2026-05-21 10:48    39  ********************
  66    2026-05-21 11:47    38  *******************
  67    2026-05-21 12:46     ?  -
  68    2026-05-21 13:45    25  ******
  69    2026-05-21 14:44     ?  -
  70    2026-05-21 15:43    31  ************
  71    2026-05-21 16:42     ?  -
  72    2026-05-21 17:41    33  **************
  73    2026-05-21 18:40    34  ***************
  74    2026-05-21 19:39    34  ***************
  75    2026-05-21 20:38     ?  -
  76    2026-05-21 21:37    28  *********
  77    2026-05-21 22:36    33  **************
  78    2026-05-21 23:35    26  *******
  79    2026-05-22 00:34    24  *****
  80    2026-05-22 01:33    24  *****
  81    2026-05-22 02:32    23  ****
  82    2026-05-22 03:31    23  ****
  83    2026-05-22 04:30    23  ****
  84    2026-05-22 05:29    24  *****
  85    2026-05-22 06:28    26  *******
  86    2026-05-22 07:27    25  ******
  87    2026-05-22 08:26    26  *******
  88    2026-05-22 09:25    24  *****
  89    2026-05-22 10:24    25  ******
  90    2026-05-22 11:23    26  *******
 ...    ..(  4 skipped).    ..  *******
  95    2026-05-22 16:18    26  *******
  96    2026-05-22 17:17    25  ******
  97    2026-05-22 18:16    24  *****
  98    2026-05-22 19:15    24  *****
  99    2026-05-22 20:14    25  ******
 ...    ..(  2 skipped).    ..  ******
 102    2026-05-22 23:11    25  ******
 103    2026-05-23 00:10    24  *****
 104    2026-05-23 01:09    24  *****
 105    2026-05-23 02:08    23  ****
 106    2026-05-23 03:07    23  ****
 107    2026-05-23 04:06    23  ****
 108    2026-05-23 05:05    24  *****
 109    2026-05-23 06:04    25  ******
 110    2026-05-23 07:03    24  *****
 ...    ..(  2 skipped).    ..  *****
 113    2026-05-23 10:00    24  *****
 114    2026-05-23 10:59    25  ******
 115    2026-05-23 11:58    26  *******
 ...    ..(  2 skipped).    ..  *******
 118    2026-05-23 14:55    26  *******
 119    2026-05-23 15:54    27  ********
 120    2026-05-23 16:53    27  ********
 121    2026-05-23 17:52    27  ********
 122    2026-05-23 18:51    26  *******
 ...    ..(  2 skipped).    ..  *******
 125    2026-05-23 21:48    26  *******
 126    2026-05-23 22:47    25  ******
 127    2026-05-23 23:46    24  *****
   0    2026-05-24 00:45    23  ****
   1    2026-05-24 01:44    23  ****
   2    2026-05-24 02:43    22  ***
   3    2026-05-24 03:42    22  ***
   4    2026-05-24 04:41    22  ***
   5    2026-05-24 05:40    23  ****
   6    2026-05-24 06:39    23  ****
   7    2026-05-24 07:38    24  *****
 ...    ..(  2 skipped).    ..  *****
  10    2026-05-24 10:35    24  *****
  11    2026-05-24 11:34    25  ******
  12    2026-05-24 12:33    25  ******
  13    2026-05-24 13:32    25  ******
  14    2026-05-24 14:31    33  **************
  15    2026-05-24 15:30    26  *******
  16    2026-05-24 16:29    25  ******
  17    2026-05-24 17:28    25  ******
  18    2026-05-24 18:27    24  *****
  19    2026-05-24 19:26     ?  -
  20    2026-05-24 20:25    20  *
  21    2026-05-24 21:24     ?  -
  22    2026-05-24 22:23    22  ***
  23    2026-05-24 23:22     ?  -
  24    2026-05-25 00:21    21  **
  25    2026-05-25 01:20    29  **********
  26    2026-05-25 02:19    29  **********
  27    2026-05-25 03:18    29  **********
  28    2026-05-25 04:17    27  ********
  29    2026-05-25 05:16    29  **********
  30    2026-05-25 06:15    30  ***********
  31    2026-05-25 07:14    29  **********
  32    2026-05-25 08:13    30  ***********
  33    2026-05-25 09:12    30  ***********
  34    2026-05-25 10:11    31  ************
  35    2026-05-25 11:10    31  ************
  36    2026-05-25 12:09    32  *************
  37    2026-05-25 13:08    32  *************

SCT Error Recovery Control command not supported

Device Statistics (GP Log 0x04)
Page  Offset Size        Value Flags Description
0x01  =====  =               =  ===  == General Statistics (rev 1) ==
0x01  0x008  4            1450  ---  Lifetime Power-On Resets
0x01  0x010  4            2451  ---  Power-on Hours
0x01  0x018  6      3999639034  ---  Logical Sectors Written
0x01  0x020  6        28838129  ---  Number of Write Commands
0x01  0x028  6       185558408  ---  Logical Sectors Read
0x01  0x030  6         1106754  ---  Number of Read Commands
0x01  0x038  6               -  ---  Date and Time TimeStamp
0x03  =====  =               =  ===  == Rotating Media Statistics (rev 1) ==
0x03  0x008  4            1787  ---  Spindle Motor Power-on Hours
0x03  0x010  4            1787  ---  Head Flying Hours
0x03  0x018  4            1725  ---  Head Load Events
0x03  0x020  4               0  ---  Number of Reallocated Logical Sectors
0x03  0x028  4               0  ---  Read Recovery Attempts
0x03  0x030  4               0  ---  Number of Mechanical Start Failures
0x03  0x038  4               0  ---  Number of Realloc. Candidate Logical Sectors
0x03  0x040  4              27  ---  Number of High Priority Unload Events
0x04  =====  =               =  ===  == General Errors Statistics (rev 1) ==
0x04  0x008  4               0  ---  Number of Reported Uncorrectable Errors
0x04  0x010  4               0  ---  Resets Between Cmd Acceptance and Completion
0x05  =====  =               =  ===  == Temperature Statistics (rev 1) ==
0x05  0x008  1              33  ---  Current Temperature
0x05  0x010  1              27  ---  Average Short Term Temperature
0x05  0x018  1              28  ---  Average Long Term Temperature
0x05  0x020  1              39  ---  Highest Temperature
0x05  0x028  1               0  ---  Lowest Temperature
0x05  0x030  1              34  ---  Highest Average Short Term Temperature
0x05  0x038  1              23  ---  Lowest Average Short Term Temperature
0x05  0x040  1              31  ---  Highest Average Long Term Temperature
0x05  0x048  1              24  ---  Lowest Average Long Term Temperature
0x05  0x050  4               0  ---  Time in Over-Temperature
0x05  0x058  1              60  ---  Specified Maximum Operating Temperature
0x05  0x060  4               0  ---  Time in Under-Temperature
0x05  0x068  1               0  ---  Specified Minimum Operating Temperature
0x06  =====  =               =  ===  == Transport Statistics (rev 1) ==
0x06  0x008  4              92  ---  Number of Hardware Resets
0x06  0x010  4               0  ---  Number of ASR Events
0x06  0x018  4               0  ---  Number of Interface CRC Errors
                                |||_ C monitored condition met
                                ||__ D supports DSN
                                |___ N normalized value

SATA Phy Event Counters (GP Log 0x11)
ID      Size     Value  Description
0x000a  2            2  Device-to-host register FISes sent due to a COMRESET
0x0001  2            0  Command failed due to ICRC error
0x0003  2            0  R_ERR response for device-to-host data FIS
0x0004  2            0  R_ERR response for host-to-device data FIS
0x0006  2            0  R_ERR response for device-to-host non-data FIS
0x0007  2            0  R_ERR response for host-to-device non-data FIS

