[sudo] password for robert: 
smartctl 6.6 2016-05-31 r4324 [x86_64-linux-4.15.0-213-generic] (local build)
Copyright (C) 2002-16, Bruce Allen, Christian Franke, www.smartmontools.org

=== START OF INFORMATION SECTION ===
Device Model:     ST2000VN004-2E4164
Serial Number:    Z52BBV0P
LU WWN Device Id: 5 000c50 0dba21f7c
Firmware Version: SC60
User Capacity:    2,000,398,934,016 bytes [2.00 TB]
Sector Sizes:     512 bytes logical, 4096 bytes physical
Rotation Rate:    5900 rpm
Form Factor:      3.5 inches
Device is:        Not in smartctl database [for details use: -P showall]
ATA Version is:   ACS-2, ACS-3 T13/2161-D revision 3b
SATA Version is:  SATA 3.1, 6.0 Gb/s (current: 6.0 Gb/s)
Local Time is:    Fri May 29 15:34:17 2026 NZST
SMART support is: Available - device has SMART capability.
SMART support is: Enabled
AAM feature is:   Unavailable
APM level is:     254 (maximum performance)
Rd look-ahead is: Enabled
Write cache is:   Enabled
ATA Security is:  Disabled, frozen [SEC2]
Wt Cache Reorder: Enabled

=== START OF READ SMART DATA SECTION ===
SMART overall-health self-assessment test result: PASSED

General SMART Values:
Offline data collection status:  (0x82)	Offline data collection activity
					was completed without error.
					Auto Offline Data Collection: Enabled.
Self-test execution status:      (   0)	The previous self-test routine completed
					without error or no self-test has ever 
					been run.
Total time to complete Offline 
data collection: 		(   97) seconds.
Offline data collection
capabilities: 			 (0x7b) SMART execute Offline immediate.
					Auto Offline data collection on/off support.
					Suspend Offline collection upon new
					command.
					Offline surface scan supported.
					Self-test supported.
					Conveyance Self-test supported.
					Selective Self-test supported.
SMART capabilities:            (0x0003)	Saves SMART data before entering
					power-saving mode.
					Supports SMART auto save timer.
Error logging capability:        (0x01)	Error logging supported.
					General Purpose Logging supported.
Short self-test routine 
recommended polling time: 	 (   1) minutes.
Extended self-test routine
recommended polling time: 	 ( 249) minutes.
Conveyance self-test routine
recommended polling time: 	 (   2) minutes.
SCT capabilities: 	       (0x10bd)	SCT Status supported.
					SCT Error Recovery Control supported.
					SCT Feature Control supported.
					SCT Data Table supported.

SMART Attributes Data Structure revision number: 10
Vendor Specific SMART Attributes with Thresholds:
ID# ATTRIBUTE_NAME          FLAGS    VALUE WORST THRESH FAIL RAW_VALUE
  1 Raw_Read_Error_Rate     POSR--   113   099   006    -    55436976
  3 Spin_Up_Time            PO----   097   096   000    -    0
  4 Start_Stop_Count        -O--CK   100   100   020    -    90
  5 Reallocated_Sector_Ct   PO--CK   100   100   010    -    0
  7 Seek_Error_Rate         POSR--   100   253   030    -    467072
  9 Power_On_Hours          -O--CK   100   100   000    -    487
 10 Spin_Retry_Count        PO--C-   100   100   097    -    0
 12 Power_Cycle_Count       -O--CK   100   100   020    -    78
184 End-to-End_Error        -O--CK   100   100   099    -    0
187 Reported_Uncorrect      -O--CK   100   100   000    -    0
188 Command_Timeout         -O--CK   100   098   000    -    4
189 High_Fly_Writes         -O-RCK   091   091   000    -    9
190 Airflow_Temperature_Cel -O---K   080   065   045    -    20 (Min/Max 15/20)
191 G-Sense_Error_Rate      -O--CK   100   100   000    -    0
192 Power-Off_Retract_Count -O--CK   100   100   000    -    5
193 Load_Cycle_Count        -O--CK   100   100   000    -    90
194 Temperature_Celsius     -O---K   020   040   000    -    20 (0 15 0 0 0)
197 Current_Pending_Sector  -O--C-   100   100   000    -    0
198 Offline_Uncorrectable   ----C-   100   100   000    -    0
199 UDMA_CRC_Error_Count    -OSRCK   200   199   000    -    42
                            ||||||_ K auto-keep
                            |||||__ C event count
                            ||||___ R error rate
                            |||____ S speed/performance
                            ||_____ O updated online
                            |______ P prefailure warning

General Purpose Log Directory Version 1
SMART           Log Directory Version 1 [multi-sector log support]
Address    Access  R/W   Size  Description
0x00       GPL,SL  R/O      1  Log Directory
0x01           SL  R/O      1  Summary SMART error log
0x02           SL  R/O      5  Comprehensive SMART error log
0x03       GPL     R/O      5  Ext. Comprehensive SMART error log
0x06           SL  R/O      1  SMART self-test log
0x07       GPL     R/O      1  Extended self-test log
0x09           SL  R/W      1  Selective self-test log
0x10       GPL     R/O      1  SATA NCQ Queued Error log
0x11       GPL     R/O      1  SATA Phy Event Counters log
0x15       GPL     R/W      1  SATA Rebuild Assist log
0x21       GPL     R/O      1  Write stream error log
0x22       GPL     R/O      1  Read stream error log
0x80-0x9f  GPL,SL  R/W     16  Host vendor specific log
0xa1       GPL,SL  VS      20  Device vendor specific log
0xa2       GPL     VS    4496  Device vendor specific log
0xa8       GPL,SL  VS     129  Device vendor specific log
0xa9       GPL,SL  VS       1  Device vendor specific log
0xab       GPL     VS       1  Device vendor specific log
0xb0       GPL     VS    5176  Device vendor specific log
0xbe-0xbf  GPL     VS   65535  Device vendor specific log
0xc0       GPL,SL  VS       1  Device vendor specific log
0xc1       GPL,SL  VS      10  Device vendor specific log
0xc3       GPL,SL  VS       8  Device vendor specific log
0xc4       GPL,SL  VS       5  Device vendor specific log
0xd1       GPL,SL  VS       8  Device vendor specific log
0xe0       GPL,SL  R/W      1  SCT Command/Status
0xe1       GPL,SL  R/W      1  SCT Data Transfer

SMART Extended Comprehensive Error Log Version: 1 (5 sectors)
No Errors Logged

SMART Extended Self-test Log Version: 1 (1 sectors)
Num  Test_Description    Status                  Remaining  LifeTime(hours)  LBA_of_first_error
# 1  Conveyance offline  Completed without error       00%       487         -
# 2  Extended offline    Completed without error       00%       484         -

SMART Selective self-test log data structure revision number 1
 SPAN  MIN_LBA  MAX_LBA  CURRENT_TEST_STATUS
    1        0        0  Not_testing
    2        0        0  Not_testing
    3        0        0  Not_testing
    4        0        0  Not_testing
    5        0        0  Not_testing
Selective self-test flags (0x0):
  After scanning selected spans, do NOT read-scan remainder of disk.
If Selective self-test is pending on power-up, resume after 0 minute delay.

SCT Status Version:                  3
SCT Version (vendor specific):       522 (0x020a)
SCT Support Level:                   1
Device State:                        Active (0)
Current Temperature:                    15 Celsius
Power Cycle Min/Max Temperature:     15/15 Celsius
Lifetime    Min/Max Temperature:     15/35 Celsius
Under/Over Temperature Limit Count:   0/0

SCT Temperature History Version:     2
Temperature Sampling Period:         1 minute
Temperature Logging Interval:        94 minutes
Min/Max recommended Temperature:      1/61 Celsius
Min/Max Temperature Limit:            2/60 Celsius
Temperature History Size (Index):    128 (124)

Index    Estimated Time   Temperature Celsius
 125    2026-05-21 08:00    18  -
 126    2026-05-21 09:34     ?  -
 127    2026-05-21 11:08    20  *
   0    2026-05-21 12:42     ?  -
   1    2026-05-21 14:16    22  ***
   2    2026-05-21 15:50     ?  -
   3    2026-05-21 17:24    22  ***
   4    2026-05-21 18:58     ?  -
   5    2026-05-21 20:32    22  ***
   6    2026-05-21 22:06     ?  -
   7    2026-05-21 23:40    22  ***
   8    2026-05-22 01:14     ?  -
   9    2026-05-22 02:48    18  -
  10    2026-05-22 04:22     ?  -
  11    2026-05-22 05:56    17  -
  12    2026-05-22 07:30     ?  -
  13    2026-05-22 09:04    16  -
  14    2026-05-22 10:38     ?  -
  15    2026-05-22 12:12    18  -
  16    2026-05-22 13:46     ?  -
  17    2026-05-22 15:20    18  -
  18    2026-05-22 16:54     ?  -
  19    2026-05-22 18:28    21  **
  20    2026-05-22 20:02     ?  -
  21    2026-05-22 21:36    25  ******
  22    2026-05-22 23:10    26  *******
  23    2026-05-23 00:44    26  *******
  24    2026-05-23 02:18    27  ********
  25    2026-05-23 03:52    27  ********
  26    2026-05-23 05:26    26  *******
  27    2026-05-23 07:00    25  ******
 ...    ..(  2 skipped).    ..  ******
  30    2026-05-23 11:42    25  ******
  31    2026-05-23 13:16    24  *****
 ...    ..(  2 skipped).    ..  *****
  34    2026-05-23 17:58    24  *****
  35    2026-05-23 19:32    26  *******
  36    2026-05-23 21:06    26  *******
  37    2026-05-23 22:40    27  ********
  38    2026-05-24 00:14    24  *****
  39    2026-05-24 01:48    24  *****
  40    2026-05-24 03:22    23  ****
  41    2026-05-24 04:56    22  ***
  42    2026-05-24 06:30    21  **
  43    2026-05-24 08:04    20  *
  44    2026-05-24 09:38    20  *
  45    2026-05-24 11:12    19  -
 ...    ..(  3 skipped).    ..  -
  49    2026-05-24 17:28    19  -
  50    2026-05-24 19:02    20  *
  51    2026-05-24 20:36    21  **
  52    2026-05-24 22:10    23  ****
  53    2026-05-24 23:44    23  ****
  54    2026-05-25 01:18    22  ***
  55    2026-05-25 02:52    22  ***
  56    2026-05-25 04:26    23  ****
  57    2026-05-25 06:00    22  ***
  58    2026-05-25 07:34    22  ***
  59    2026-05-25 09:08    22  ***
  60    2026-05-25 10:42    21  **
  61    2026-05-25 12:16    21  **
  62    2026-05-25 13:50    21  **
  63    2026-05-25 15:24    20  *
  64    2026-05-25 16:58    20  *
  65    2026-05-25 18:32    20  *
  66    2026-05-25 20:06    19  -
  67    2026-05-25 21:40    21  **
  68    2026-05-25 23:14    22  ***
  69    2026-05-26 00:48    22  ***
  70    2026-05-26 02:22    23  ****
  71    2026-05-26 03:56    24  *****
 ...    ..(  2 skipped).    ..  *****
  74    2026-05-26 08:38    24  *****
  75    2026-05-26 10:12    23  ****
  76    2026-05-26 11:46    24  *****
  77    2026-05-26 13:20    24  *****
  78    2026-05-26 14:54    23  ****
  79    2026-05-26 16:28    23  ****
  80    2026-05-26 18:02    24  *****
  81    2026-05-26 19:36    24  *****
  82    2026-05-26 21:10    26  *******
  83    2026-05-26 22:44    27  ********
 ...    ..(  2 skipped).    ..  ********
  86    2026-05-27 03:26    27  ********
  87    2026-05-27 05:00    28  *********
  88    2026-05-27 06:34    26  *******
  89    2026-05-27 08:08    27  ********
  90    2026-05-27 09:42     ?  -
  91    2026-05-27 11:16    25  ******
  92    2026-05-27 12:50    27  ********
  93    2026-05-27 14:24    26  *******
  94    2026-05-27 15:58    25  ******
  95    2026-05-27 17:32    25  ******
  96    2026-05-27 19:06    25  ******
  97    2026-05-27 20:40     ?  -
  98    2026-05-27 22:14    23  ****
  99    2026-05-27 23:48     ?  -
 100    2026-05-28 01:22    26  *******
 101    2026-05-28 02:56    35  ****************
 102    2026-05-28 04:30    23  ****
 103    2026-05-28 06:04    32  *************
 104    2026-05-28 07:38    33  **************
 105    2026-05-28 09:12    33  **************
 106    2026-05-28 10:46    25  ******
 107    2026-05-28 12:20    32  *************
 ...    ..(  3 skipped).    ..  *************
 111    2026-05-28 18:36    32  *************
 112    2026-05-28 20:10     ?  -
 113    2026-05-28 21:44    16  -
 114    2026-05-28 23:18     ?  -
 115    2026-05-29 00:52    23  ****
 116    2026-05-29 02:26    27  ********
 117    2026-05-29 04:00    25  ******
 118    2026-05-29 05:34    28  *********
 119    2026-05-29 07:08    30  ***********
 120    2026-05-29 08:42    24  *****
 121    2026-05-29 10:16     ?  -
 122    2026-05-29 11:50    22  ***
 123    2026-05-29 13:24     ?  -
 124    2026-05-29 14:58    15  -

SCT Error Recovery Control:
           Read:     70 (7.0 seconds)
          Write:     70 (7.0 seconds)

Device Statistics (GP/SMART Log 0x04) not supported

SATA Phy Event Counters (GP Log 0x11)
ID      Size     Value  Description
0x000a  2            3  Device-to-host register FISes sent due to a COMRESET
0x0001  2            0  Command failed due to ICRC error
0x0003  2            0  R_ERR response for device-to-host data FIS
0x0004  2            0  R_ERR response for host-to-device data FIS
0x0006  2            0  R_ERR response for device-to-host non-data FIS
0x0007  2            0  R_ERR response for host-to-device non-data FIS

