[sudo] password for robert: 
smartctl 6.6 2016-05-31 r4324 [x86_64-linux-4.15.0-213-generic] (local build)
Copyright (C) 2002-16, Bruce Allen, Christian Franke, www.smartmontools.org

=== START OF INFORMATION SECTION ===
Device Model:     ST2000VN004-2E4164
Serial Number:    Z52BBV0P
LU WWN Device Id: 5 000c50 0dba21f7c
Firmware Version: SC60
User Capacity:    2,000,398,934,016 bytes [2.00 TB]
Sector Sizes:     512 bytes logical, 4096 bytes physical
Rotation Rate:    5900 rpm
Form Factor:      3.5 inches
Device is:        Not in smartctl database [for details use: -P showall]
ATA Version is:   ACS-2, ACS-3 T13/2161-D revision 3b
SATA Version is:  SATA 3.1, 6.0 Gb/s (current: 6.0 Gb/s)
Local Time is:    Tue May 26 13:05:27 2026 NZST
SMART support is: Available - device has SMART capability.
SMART support is: Enabled
AAM feature is:   Unavailable
APM level is:     254 (maximum performance)
Rd look-ahead is: Enabled
Write cache is:   Enabled
ATA Security is:  Disabled, frozen [SEC2]
Wt Cache Reorder: Enabled

=== START OF READ SMART DATA SECTION ===
SMART overall-health self-assessment test result: PASSED

General SMART Values:
Offline data collection status:  (0x82)	Offline data collection activity
					was completed without error.
					Auto Offline Data Collection: Enabled.
Self-test execution status:      (   0)	The previous self-test routine completed
					without error or no self-test has ever 
					been run.
Total time to complete Offline 
data collection: 		(   97) seconds.
Offline data collection
capabilities: 			 (0x7b) SMART execute Offline immediate.
					Auto Offline data collection on/off support.
					Suspend Offline collection upon new
					command.
					Offline surface scan supported.
					Self-test supported.
					Conveyance Self-test supported.
					Selective Self-test supported.
SMART capabilities:            (0x0003)	Saves SMART data before entering
					power-saving mode.
					Supports SMART auto save timer.
Error logging capability:        (0x01)	Error logging supported.
					General Purpose Logging supported.
Short self-test routine 
recommended polling time: 	 (   1) minutes.
Extended self-test routine
recommended polling time: 	 ( 249) minutes.
Conveyance self-test routine
recommended polling time: 	 (   2) minutes.
SCT capabilities: 	       (0x10bd)	SCT Status supported.
					SCT Error Recovery Control supported.
					SCT Feature Control supported.
					SCT Data Table supported.

SMART Attributes Data Structure revision number: 10
Vendor Specific SMART Attributes with Thresholds:
ID# ATTRIBUTE_NAME          FLAGS    VALUE WORST THRESH FAIL RAW_VALUE
  1 Raw_Read_Error_Rate     POSR--   113   099   006    -    55386120
  3 Spin_Up_Time            PO----   097   096   000    -    0
  4 Start_Stop_Count        -O--CK   100   100   020    -    89
  5 Reallocated_Sector_Ct   PO--CK   100   100   010    -    0
  7 Seek_Error_Rate         POSR--   100   253   030    -    466833
  9 Power_On_Hours          -O--CK   100   100   000    -    486
 10 Spin_Retry_Count        PO--C-   100   100   097    -    0
 12 Power_Cycle_Count       -O--CK   100   100   020    -    77
184 End-to-End_Error        -O--CK   100   100   099    -    0
187 Reported_Uncorrect      -O--CK   100   100   000    -    0
188 Command_Timeout         -O--CK   100   098   000    -    4
189 High_Fly_Writes         -O-RCK   091   091   000    -    9
190 Airflow_Temperature_Cel -O---K   076   065   045    -    24 (Min/Max 22/24)
191 G-Sense_Error_Rate      -O--CK   100   100   000    -    0
192 Power-Off_Retract_Count -O--CK   100   100   000    -    5
193 Load_Cycle_Count        -O--CK   100   100   000    -    89
194 Temperature_Celsius     -O---K   024   040   000    -    24 (0 16 0 0 0)
197 Current_Pending_Sector  -O--C-   100   100   000    -    0
198 Offline_Uncorrectable   ----C-   100   100   000    -    0
199 UDMA_CRC_Error_Count    -OSRCK   200   199   000    -    42
                            ||||||_ K auto-keep
                            |||||__ C event count
                            ||||___ R error rate
                            |||____ S speed/performance
                            ||_____ O updated online
                            |______ P prefailure warning

General Purpose Log Directory Version 1
SMART           Log Directory Version 1 [multi-sector log support]
Address    Access  R/W   Size  Description
0x00       GPL,SL  R/O      1  Log Directory
0x01           SL  R/O      1  Summary SMART error log
0x02           SL  R/O      5  Comprehensive SMART error log
0x03       GPL     R/O      5  Ext. Comprehensive SMART error log
0x06           SL  R/O      1  SMART self-test log
0x07       GPL     R/O      1  Extended self-test log
0x09           SL  R/W      1  Selective self-test log
0x10       GPL     R/O      1  SATA NCQ Queued Error log
0x11       GPL     R/O      1  SATA Phy Event Counters log
0x15       GPL     R/W      1  SATA Rebuild Assist log
0x21       GPL     R/O      1  Write stream error log
0x22       GPL     R/O      1  Read stream error log
0x80-0x9f  GPL,SL  R/W     16  Host vendor specific log
0xa1       GPL,SL  VS      20  Device vendor specific log
0xa2       GPL     VS    4496  Device vendor specific log
0xa8       GPL,SL  VS     129  Device vendor specific log
0xa9       GPL,SL  VS       1  Device vendor specific log
0xab       GPL     VS       1  Device vendor specific log
0xb0       GPL     VS    5176  Device vendor specific log
0xbe-0xbf  GPL     VS   65535  Device vendor specific log
0xc0       GPL,SL  VS       1  Device vendor specific log
0xc1       GPL,SL  VS      10  Device vendor specific log
0xc3       GPL,SL  VS       8  Device vendor specific log
0xc4       GPL,SL  VS       5  Device vendor specific log
0xd1       GPL,SL  VS       8  Device vendor specific log
0xe0       GPL,SL  R/W      1  SCT Command/Status
0xe1       GPL,SL  R/W      1  SCT Data Transfer

SMART Extended Comprehensive Error Log Version: 1 (5 sectors)
No Errors Logged

SMART Extended Self-test Log Version: 1 (1 sectors)
Num  Test_Description    Status                  Remaining  LifeTime(hours)  LBA_of_first_error
# 1  Extended offline    Completed without error       00%       484         -

SMART Selective self-test log data structure revision number 1
 SPAN  MIN_LBA  MAX_LBA  CURRENT_TEST_STATUS
    1        0        0  Not_testing
    2        0        0  Not_testing
    3        0        0  Not_testing
    4        0        0  Not_testing
    5        0        0  Not_testing
Selective self-test flags (0x0):
  After scanning selected spans, do NOT read-scan remainder of disk.
If Selective self-test is pending on power-up, resume after 0 minute delay.

SCT Status Version:                  3
SCT Version (vendor specific):       522 (0x020a)
SCT Support Level:                   1
Device State:                        Active (0)
Current Temperature:                    22 Celsius
Power Cycle Min/Max Temperature:     22/22 Celsius
Lifetime    Min/Max Temperature:     16/35 Celsius
Under/Over Temperature Limit Count:   0/0

SCT Temperature History Version:     2
Temperature Sampling Period:         1 minute
Temperature Logging Interval:        94 minutes
Min/Max recommended Temperature:      1/61 Celsius
Min/Max Temperature Limit:            2/60 Celsius
Temperature History Size (Index):    128 (122)

Index    Estimated Time   Temperature Celsius
 123    2026-05-18 04:48    17  -
 124    2026-05-18 06:22     ?  -
 125    2026-05-18 07:56    18  -
 126    2026-05-18 09:30     ?  -
 127    2026-05-18 11:04    20  *
   0    2026-05-18 12:38     ?  -
   1    2026-05-18 14:12    22  ***
   2    2026-05-18 15:46     ?  -
   3    2026-05-18 17:20    22  ***
   4    2026-05-18 18:54     ?  -
   5    2026-05-18 20:28    22  ***
   6    2026-05-18 22:02     ?  -
   7    2026-05-18 23:36    22  ***
   8    2026-05-19 01:10     ?  -
   9    2026-05-19 02:44    18  -
  10    2026-05-19 04:18     ?  -
  11    2026-05-19 05:52    17  -
  12    2026-05-19 07:26     ?  -
  13    2026-05-19 09:00    16  -
  14    2026-05-19 10:34     ?  -
  15    2026-05-19 12:08    18  -
  16    2026-05-19 13:42     ?  -
  17    2026-05-19 15:16    18  -
  18    2026-05-19 16:50     ?  -
  19    2026-05-19 18:24    21  **
  20    2026-05-19 19:58     ?  -
  21    2026-05-19 21:32    25  ******
  22    2026-05-19 23:06    26  *******
  23    2026-05-20 00:40    26  *******
  24    2026-05-20 02:14    27  ********
  25    2026-05-20 03:48    27  ********
  26    2026-05-20 05:22    26  *******
  27    2026-05-20 06:56    25  ******
 ...    ..(  2 skipped).    ..  ******
  30    2026-05-20 11:38    25  ******
  31    2026-05-20 13:12    24  *****
 ...    ..(  2 skipped).    ..  *****
  34    2026-05-20 17:54    24  *****
  35    2026-05-20 19:28    26  *******
  36    2026-05-20 21:02    26  *******
  37    2026-05-20 22:36    27  ********
  38    2026-05-21 00:10    24  *****
  39    2026-05-21 01:44    24  *****
  40    2026-05-21 03:18    23  ****
  41    2026-05-21 04:52    22  ***
  42    2026-05-21 06:26    21  **
  43    2026-05-21 08:00    20  *
  44    2026-05-21 09:34    20  *
  45    2026-05-21 11:08    19  -
 ...    ..(  3 skipped).    ..  -
  49    2026-05-21 17:24    19  -
  50    2026-05-21 18:58    20  *
  51    2026-05-21 20:32    21  **
  52    2026-05-21 22:06    23  ****
  53    2026-05-21 23:40    23  ****
  54    2026-05-22 01:14    22  ***
  55    2026-05-22 02:48    22  ***
  56    2026-05-22 04:22    23  ****
  57    2026-05-22 05:56    22  ***
  58    2026-05-22 07:30    22  ***
  59    2026-05-22 09:04    22  ***
  60    2026-05-22 10:38    21  **
  61    2026-05-22 12:12    21  **
  62    2026-05-22 13:46    21  **
  63    2026-05-22 15:20    20  *
  64    2026-05-22 16:54    20  *
  65    2026-05-22 18:28    20  *
  66    2026-05-22 20:02    19  -
  67    2026-05-22 21:36    21  **
  68    2026-05-22 23:10    22  ***
  69    2026-05-23 00:44    22  ***
  70    2026-05-23 02:18    23  ****
  71    2026-05-23 03:52    24  *****
 ...    ..(  2 skipped).    ..  *****
  74    2026-05-23 08:34    24  *****
  75    2026-05-23 10:08    23  ****
  76    2026-05-23 11:42    24  *****
  77    2026-05-23 13:16    24  *****
  78    2026-05-23 14:50    23  ****
  79    2026-05-23 16:24    23  ****
  80    2026-05-23 17:58    24  *****
  81    2026-05-23 19:32    24  *****
  82    2026-05-23 21:06    26  *******
  83    2026-05-23 22:40    27  ********
 ...    ..(  2 skipped).    ..  ********
  86    2026-05-24 03:22    27  ********
  87    2026-05-24 04:56    28  *********
  88    2026-05-24 06:30    26  *******
  89    2026-05-24 08:04    27  ********
  90    2026-05-24 09:38     ?  -
  91    2026-05-24 11:12    25  ******
  92    2026-05-24 12:46    27  ********
  93    2026-05-24 14:20    26  *******
  94    2026-05-24 15:54    25  ******
  95    2026-05-24 17:28    25  ******
  96    2026-05-24 19:02    25  ******
  97    2026-05-24 20:36     ?  -
  98    2026-05-24 22:10    23  ****
  99    2026-05-24 23:44     ?  -
 100    2026-05-25 01:18    26  *******
 101    2026-05-25 02:52    35  ****************
 102    2026-05-25 04:26    23  ****
 103    2026-05-25 06:00    32  *************
 104    2026-05-25 07:34    33  **************
 105    2026-05-25 09:08    33  **************
 106    2026-05-25 10:42    25  ******
 107    2026-05-25 12:16    32  *************
 ...    ..(  3 skipped).    ..  *************
 111    2026-05-25 18:32    32  *************
 112    2026-05-25 20:06     ?  -
 113    2026-05-25 21:40    16  -
 114    2026-05-25 23:14     ?  -
 115    2026-05-26 00:48    23  ****
 116    2026-05-26 02:22    27  ********
 117    2026-05-26 03:56    25  ******
 118    2026-05-26 05:30    28  *********
 119    2026-05-26 07:04    30  ***********
 120    2026-05-26 08:38    24  *****
 121    2026-05-26 10:12     ?  -
 122    2026-05-26 11:46    22  ***

SCT Error Recovery Control:
           Read:     70 (7.0 seconds)
          Write:     70 (7.0 seconds)

Device Statistics (GP/SMART Log 0x04) not supported

SATA Phy Event Counters (GP Log 0x11)
ID      Size     Value  Description
0x000a  2            2  Device-to-host register FISes sent due to a COMRESET
0x0001  2            0  Command failed due to ICRC error
0x0003  2            0  R_ERR response for device-to-host data FIS
0x0004  2            0  R_ERR response for host-to-device data FIS
0x0006  2            0  R_ERR response for device-to-host non-data FIS
0x0007  2            0  R_ERR response for host-to-device non-data FIS

